Title,Link,Rank
"The Iran War's Most Precious Commodity Isn't Oil, It's Desalinated Water",https://www.bloomberg.com/opinion/articles/2026-03-04/iran-war-the-most-precious-commodity-is-water-not-oil,440.
The Shady World of IP Leasing,https://acid.vegas/blog/the-shady-world-of-ip-leasing/,441.
Qwen3.5 122B and 35B models offer Sonnet 4.5 performance on local computers,https://venturebeat.com/technology/alibabas-new-open-source-qwen3-5-medium-models-offer-sonnet-4-5-performance,442.
Don't make me talk to your chatbot,https://raymyers.org/post/dont-make-me-talk-to-your-chatbot/,443.
Let's discuss sandbox isolation,https://www.shayon.dev/post/2026/52/lets-discuss-sandbox-isolation/,444.
"48x32, a 1536 LED Game Computer",https://jacquesmattheij.com/48x32-introduction/,445.
BYD rolls out EV batteries with 5-minute 'flash charging.' But there's a catch,https://techcrunch.com/2026/03/05/byd-rolls-out-ev-batteries-with-5-minute-flash-charging-but-theres-a-catch/,446.
Phi-4-reasoning-vision and the lessons of training a multimodal reasoning model,https://www.microsoft.com/en-us/research/blog/phi-4-reasoning-vision-and-the-lessons-of-training-a-multimodal-reasoning-model/,447.
Free IP Geolocation Database,https://ip66.dev/,448.
U.S. science agency moves to restrict foreign scientists from its labs,https://www.science.org/content/article/nist-moves-restrict-foreign-scientists-its-labs,449.
Writing a Guide to SDF Fonts,https://www.redblobgames.com/blog/2026-02-26-writing-a-guide-to-sdf-fonts/,450.
When does MCP make sense vs CLI?,https://ejholmes.github.io/2026/02/28/mcp-is-dead-long-live-the-cli.html,451.
Closure of the Weatheradio service in Canada,https://www.rac.ca/rac-responds-to-the-closure-of-the-weatherradio-service-in-canada/,452.
Tove Jansson's criticized illustrations of The Hobbit (2023),https://tovejansson.com/hobbit-tolkien/,453.
A pretty looking web for a quantum mechanics tool,https://github.com/Jamessfks/mace,454.
Dyson Spheres on the Hertzsprung-Russell diagram,https://arxiv.org/abs/2602.23270,455.
Prediction markets on Deutsche Bahn departure delays,https://bahn.bet,456.
"""Clothing-as-a-Service"" startup charged with $300M fraud (2025)",https://www.cnbc.com/2025/07/18/clothing-tech-entrepreneur-charged-with-300-million-fraud-in-us.html,457.
Show HN: Open-sourced a web client that lets any device use Apple's on-device AI,https://github.com/Techopolis/perspective-intelligence-web-community,458.
How to Kill the Code Review,https://www.latent.space/p/reviews-dead,459.
Cash issuing terminals,https://computer.rip/2026-02-27-ibm-atm.html,460.
Show HN: Demucs music stem separator rewritten in Rust – runs in the browser,https://github.com/nikhilunni/demucs-rs,461.
Father claims Google's AI product fuelled son's delusional spiral,https://www.bbc.com/news/articles/czx44p99457o,462.
Mexican government partially unblocks secure internet,https://globalvoices.org/2026/03/03/mexican-government-partially-unblocks-secure-internet/,463.
Israel Spent Years Hacking Tehran Traffic Cameras to Track Khamenei,https://thedefensepost.com/2026/03/04/israel-traffic-cameras-track-khamenei/,464.
Trump Bought Netflix Debt Amid Paramount's Fight for Warner Bros,https://www.hollywoodreporter.com/business/business-news/trump-bought-netflix-bonds-amid-paramount-warners-fight-1236521512/,465.
Blue Brain Nexus – A knowledge graph for data-driven science,https://github.com/BlueBrain/nexus,466.
"Workers at top US low-wage firms rely on public assistance, report says",https://www.theguardian.com/business/2026/mar/04/workers-medicaid-snap-low-pay,467.
Exploiting Iran: A Political Timeline,https://github.com/thinkhuman/iranwest/blob/main/exploitingiran.md,468.
Moving to Sweden as an American,https://departure.blog/moving-to-sweden-as-an-american/,469.
Rydberg atoms detect clear signals from a handheld radio,https://phys.org/news/2026-02-rydberg-atoms-handheld-radio.html,470.
'Anthropic CEO says US govt hostility linked to Trump donations [Leaked memo],https://www.wionews.com/world/-no-dictator-style-praise-anthropic-ceo-says-us-govt-hostility-linked-to-trump-donations-slams-openai-s-altman-in-internal-memo-report-1772698855018,471.
"Felix ""fx"" Lindner has died",https://blog.recurity-labs.com/2026-03-02/Farewell_Felix,472.
Show HN: Your AI Slop Bores Me,https://www.youraislopbores.me/,473.
Aura-State: Formally Verified LLM State Machine Compiler,item?id=47209315,474.
BYD's Second-Generation Blade Battery Makes Western EV Tech Look Ancient,https://insideevs.com/news/789094/byd-second-generation-blade-battery/,475.
The inner workings of TCP zero-copy,https://blog.tohojo.dk/2026/02/the-inner-workings-of-tcp-zero-copy.html,476.
Show HN: Now I Get It – Translate scientific papers into interactive webpages,https://nowigetit.us,477.
MCP server that reduces Claude Code context consumption by 98%,https://mksg.lu/blog/context-mode,478.
The JVG algorithm could break RSA-2048 encryption with fewer than 5k qubits,https://briefglance.com/articles/new-quantum-algorithm-warns-of-an-accelerated-crypto-apocalypse,479.
"Show HN: Agent Action Protocol (AAP) – MCP got us started, but is insufficient",https://github.com/agentactionprotocol/aap/,480.
What if it's World War III?,https://colinbeavan.substack.com/p/what-if-its-world-war-iii,481.
Hormuz Is the Hidden Risk to the AI Economy,https://www.bloomberg.com/opinion/articles/2026-03-05/iran-war-hormuz-is-the-hidden-risk-to-the-ai-economy,482.
Rust: The Unlikely Engine of the Vibe Coding Era,https://www.forbes.com/councils/forbestechcouncil/2026/03/03/rust-the-unlikely-engine-of-the-vibe-coding-era/,483.
Why XML tags are so fundamental to Claude,https://glthr.com/XML-fundamental-to-Claude,484.
Show HN: Visual Lambda Calculus – a thesis project (2008) revived for the web,https://github.com/bntre/visual-lambda,485.
TV's TV (1987) & TV Games Encyclopedia (1988),https://blog.gingerbeardman.com/2026/03/01/tvs-tv-1987-and-tv-games-encyclopedia-1988/,486.
Block the “Upgrade to Tahoe” alerts,https://robservatory.com/block-the-upgrade-to-tahoe-alerts-and-system-settings-indicator/,487.
Mexico Mandates Biometric SIM Registration for All Phone Numbers,https://reclaimthenet.org/mexico-mandates-biometric-sim-registration-for-all-phone-numbers,488.
How did MS-DOS decide on two seconds to keep the floppy disk cache valid?,https://devblogs.microsoft.com/oldnewthing/20190924-00/?p=102915,489.
RAG vs. Skill vs. MCP vs. RLM,https://blog.alexewerlof.com/p/rag-vs-skill-vs-mcp-vs-rlm,490.
Talos: Hardware accelerator for deep convolutional neural networks,https://talos.wtf/,491.
"Boss-CSS: I created another ""CSS-in-JS"" lib",https://dev.to/wintercounter/boss-css-i-created-another-css-in-js-lib-and-here-is-why-23kc,492.
A Knock on the Window and a Glimpse of America's Surveillance Future,https://www.motherjones.com/politics/2026/03/mobile-fortify-face-scan-dhs-kristi-noem-database-technology/,493.
Addressing Antigravity Bans and Reinstating Access,https://github.com/google-gemini/gemini-cli/discussions/20632,494.
Why mathematicians hate Good Will Hunting,https://www.scientificamerican.com/article/why-mathematicians-hate-good-will-hunting/,495.
Pentagon Says It's Told Anthropic the Firm Is Supply-Chain Risk,https://www.bloomberg.com/news/articles/2026-03-05/pentagon-says-it-s-told-anthropic-the-firm-is-supply-chain-risk,496.
Tim Sweeney signed away his right to criticize Google until 2032,https://www.theverge.com/news/889595/tim-sweeney-signed-away-his-right-to-criticize-google-until-2032,497.
"NASA announces overhaul of Artemis program amid safety concerns, delays",https://www.cbsnews.com/news/nasa-artemis-moon-program-overhaul/,498.
Trump fires Kristi Noem as DHS secretary,https://www.wsj.com/politics/policy/trump-dhs-kristi-noem-markwayne-mullin-85815862,499.
Building a Minimal Transformer for 10-digit Addition,https://alexlitzenberger.com/blog/post.html?post=/building_a_minimal_transformer_for_10_digit_addition,500.
"Show HN: Claude-File-Recovery, recover files from your ~/.claude sessions",https://github.com/hjtenklooster/claude-file-recovery,501.
Show HN: We want to displace Notion with collaborative Markdown files,https://www.moment.dev/,502.
The Predatory Hegemon,https://www.foreignaffairs.com/united-states/predatory-hegemon-walt,503.
AI is making junior devs useless,https://beabetterdev.com/2026/03/01/ai-is-making-junior-devs-useless/,504.
"Oracle plans job cuts as data center costs rise, Bloomberg News reports",https://www.reuters.com/business/oracle-plans-thousands-job-cuts-data-center-costs-rise-bloomberg-news-reports-2026-03-05/,505.
"Libxml2 Enterprise Edition (AGPL, from the previous maintainer)",https://codeberg.org/nwellnhof/libxml2-ee,506.
Claude dethrones ChatGPT as top U.S. app after Pentagon saga,https://www.axios.com/2026/03/01/anthropic-claude-chatgpt-app-downloads-pentagon,507.
GitHub Copilot CLI downloads and executes malware,https://www.promptarmor.com/resources/github-copilot-cli-downloads-and-executes-malware,508.
This job has become the ultimate case study why AI won't replace human workers,https://www.cnn.com/2026/02/09/tech/ai-replacing-jobs-concerns-radiology,509.
Circle Games (2019),https://srconstantin.wordpress.com/2019/06/06/circle-games/,510.
Earthquake-Proof Foundations,https://practical.engineering/blog/2026/3/3/earthquake-proof-foundations,511.
Microsoft Creative Writer (1993),https://classicreload.com/play/win3x-creative-writer.html,512.
"Vercel down in Dubai, EU affected also",https://www.vercel-status.com,513.
Border-Image Tool,https://jacobfilipp.com/borderimage/,514.
What keeps IoT devices running for a decade,https://mooracle.io/blog/building-iiot-that-lasts/,515.
"Research shows 41 US states are getting warmer, all in slightly different ways",https://phys.org/news/2026-02-states-warmer-slightly-ways.html,516.
Tim Sweeney signed away his right to criticize Google until 2032,https://www.theverge.com/news/889595/tim-sweeney-signed-away-his-right-to-criticize-google-until-2032,517.
'What is the game plan?': The Iran war is unsettling China and its ambitions,https://www.bbc.com/news/articles/c2044vzrdpzo,518.
Apple Does Fusion,https://om.co/2026/03/03/apple-does-fusion/,519.
AI Isn't Replacing SREs. It's Deskilling Them,https://newsletter.signoz.io/p/ai-isnt-replacing-sres-its-deskilling,520.
Pass-Through of Tariffs: Evidence from European Wine Imports,https://www.nber.org/202603/digest/pass-through-tariffs-evidence-european-wine-imports,521.
"/e/OS is a complete, fully “deGoogled” mobile ecosystem",https://e.foundation/e-os/,522.
Show HN: Audio Toolkit for Agents,https://github.com/shiehn/sas-audio-processor,523.
Decoding GPU Efficiency: The FLOPs Fallacy,https://clockwork.io/blog/decoding-gpu-efficiency-part-1-the-flops-fallacy/,524.
"GLP-1 drugs protect against new or worsening addictions, large study shows",https://www.reuters.com/business/healthcare-pharmaceuticals/glp-1-drugs-protect-against-new-or-worsening-addictions-large-study-shows-2026-03-04/,525.
In 1985 Maxell built a bunch of life-size robots for its bad floppy ad,https://buttondown.com/suchbadtechads/archive/maxell-life-size-robots/,526.
Lil' Fun Langs' Guts,https://taylor.town/scrapscript-001,527.
Apple Does Not Include a Charger with All New MacBooks in UK and EU,https://www.macrumors.com/2026/03/04/macbook-neo-no-charger-in-uk-or-eu/,528.
The exploitation paradox in open source,https://lwn.net/SubscriberLink/1058031/a1b77f8039faed6c/,529.
"Intercepting messages inside Is­Dialog­Message, installing the message filter",https://devblogs.microsoft.com/oldnewthing/20260226-00/?p=112090,530.
Trump fires Homeland Security Secretary Noem after criticism,https://apnews.com/article/trump-homeland-security-noem-mullin-38c583b3cef97b4ef60d84b8f8b5961a,531.
Nike Is Moving Jobs to Low-Wage Regions of Indonesia,https://www.propublica.org/article/nike-jobs-indonesia-living-wages,532.
OpenAI fires an employee for prediction market insider trading,https://www.wired.com/story/openai-fires-employee-insider-trading-polymarket-kalshi/,533.
Kristi Noem Misled Congress About Top Aide's Role in DHS Contracts,https://www.propublica.org/article/kristi-noem-dhs-misled-senate-judiciary-corey-lewandowski-contracts,534.
53% of U.S. adults say Americans have bad morals and ethics,https://www.pewresearch.org/religion/2026/03/05/in-25-country-survey-americans-especially-likely-to-view-fellow-citizens-as-morally-bad/,535.
Open source calculator firmware DB48X forbids CA/CO use due to age verification,https://github.com/c3d/db48x/commit/7819972b641ac808d46c54d3f5d1df70d706d286,536.
Claude Code escapes its own denylist and sandbox,https://ona.com/stories/how-claude-code-escapes-its-own-denylist-and-sandbox,537.
NASA now officially has no plans to use new mobile launcher for Artemis,https://phys.org/news/2026-03-nasa-mobile-launcher-artemis.html,538.
Field notes from the circus of corporate AI adoption,https://mildlyverbose.mataroa.blog/blog/come-one-come-all-to-the-spectacular-corporate-ai-circus/,539.
China's 450kmph bullet train is the fastest ever built,https://www.executivetraveller.com/news/china-cr450-world-s-fastest-bullet-train,540.
Cluely CEO Roy Lee admits to publicly lying about revenue numbers last year,https://techcrunch.com/2026/03/05/cluely-ceo-roy-lee-admits-to-publicly-lying-about-revenue-numbers-last-year/,541.
You can't use a code editor when you're under 18 now?,https://mastodon.online/@marekfort/116164253291515471,542.
Running Llama Inference on Intel Itanium,https://medium.com/@tglozar/running-llama-inference-on-intel-itanium-part-2-045d663fe5d4,543.
"Anthropic's AI tool Claude central to U.S. campaign in Iran, amid a bitter feud",https://www.washingtonpost.com/technology/2026/03/04/anthropic-ai-iran-campaign/,544.
Tracing Discord's Elixir Systems (Without Melting Everything),https://discord.com/blog/tracing-discords-elixir-systems-without-melting-everything,545.
A Grand Vision for Rust,https://blog.yoshuawuyts.com/a-grand-vision-for-rust/,546.
Bars close and hundreds lose jobs as US firm buys Brewdog in £33M deal,https://www.bbc.com/news/articles/c05v0p1d0peo,547.
The Science of Detecting LLM-Generated Text (2024),https://dl.acm.org/doi/10.1145/3624725,548.
Don't Cite Unsold eBay Listing Prices,https://blog.danlew.net/2026/01/17/dont-cite-unsold-ebay-listing-prices/,549.
Running Neural Amp Modeler on embedded hardware,https://www.tone3000.com/blog/running-nam-on-embedded-hardware,550.
Show HN: Giggles – A batteries-included React framework for TUIs,https://github.com/zion-off/giggles,551.
Haptics: Tactile Feedback for the Mobile Web,https://haptics.lochie.me/,552.
OpenAI is developing alternative to Microsoft's GitHub,https://www.reuters.com/business/openai-is-developing-alternative-microsofts-github-information-reports-2026-03-03/,553.
"Show HN: Glyph, a local-first Markdown notes app for macOS built with Rust",https://glyphformac.com/,554.
Senate fails to block US involvement in Iran war,https://www.usatoday.com/story/news/politics/2026/03/04/iran-war-powers-resolution-senate-vote/88963809007/,555.
A Day in the Life of an Enshittificator [video],https://www.youtube.com/watch?v=T4Upf_B9RLQ,556.
President Trump bans Anthropic from use in government systems,https://www.npr.org/2026/02/27/nx-s1-5729118/trump-anthropic-pentagon-openai-ai-weapons-ban,557.
"I Fuzzed, and Vibe Fixed, the Vibed C Compiler",https://john.regehr.org/writing/claude_c_compiler.html,558.
Show HN: Badge that shows how well your codebase fits in an LLM's context window,https://github.com/qwibitai/nanoclaw/tree/main/repo-tokens,559.
Interactive Fiction Theory and Criticism,https://the-rosebush.com/,560.
Ask HN: How are you all staying sane?,item?id=47215569,561.
"Rob Grant, creator of Red Dwarf, has died",https://www.beyondthejoke.co.uk/content/17193/red-dwarf-rob-grant,562.
Why consumer choice is stripped away and how the tech industry profits from it,https://fireborn.mataroa.blog/blog/because-fuck-you-why-consumer-choice-is-being-stripped-away-and-how-the-tech-industry-profits-from-it/,563.
Show HN: React-Kino – Cinematic scroll storytelling for React (1KB core),https://github.com/btahir/react-kino,564.
No Silver Bullet [pdf],https://www.cs.dartmouth.edu/~cs50/Reading/NoSilverBullet.pdf,565.
A Word to the Wise: Don't Trust A.I. To File Your Taxes,https://www.nytimes.com/2026/03/05/technology/artificial-intelligence-taxes-tax-refund.html,566.
What canceled my Go context?,https://rednafi.com/go/context-cancellation-cause/,567.
The Intel 486DX2 CPU,https://dfarq.homeip.net/intel-486dx2-cpu/,568.
"Running Mainline Linux, U-Boot, and Mesa on Rockchip: A Year in Review",https://www.collabora.com/news-and-blog/blog/2026/03/02/running-mainline-linux-u-boot-and-mesa-on-rockchip-a-year-in-review/,569.
Don't trust AI agents,https://nanoclaw.dev/blog/nanoclaw-security-model,570.
"New York could prohibit chatbot medical, legal, engineering advice",https://folding-sky.com/blog/ny-senate-bill-s7263-chatbot-liability,571.
Why No AI Games?,https://franklantz.substack.com/p/why-no-ai-games,572.
Show HN: SplatHash – A lightweight alternative to BlurHash and ThumbHash,https://github.com/junevm/splathash,573.
Labubu sues 3D printer maker Bambu Lab for items made by its users,https://www.tomshardware.com/3d-printing/labubu-sues-3d-printer-maker-bambu-lab-for-items-made-by-its-users-makerworld-design-repository-in-hot-water-over-ip-theft-by-its-users,574.
How to sew a Hyperbolic Blanket (2021),https://www.geometrygames.org/HyperbolicBlanket/index.html,575.
"Show HN: Cloudwright – validate, cost, and export cloud architectures from text",https://github.com/xmpuspus/cloudwright,576.
"California's Digital Age Assurance Act, and FOSS",https://runxiyu.org/comp/ab1043/,577.
Gulf insurance costs soar 12-fold despite US president's guarantee,https://www.ft.com/content/865dab47-f9b8-4c81-88e6-15894cbda58c,578.
Anthropic and Alignment (Ben Thompson),https://stratechery.com/2026/anthropic-and-alignment/,579.
ESA's Mars orbiters watch solar superstorm hit the red planet,https://phys.org/news/2026-03-esa-mars-orbiters-solar-superstorm.html,580.
Show HN: Gapless.js – gapless web audio playback,https://github.com/RelistenNet/gapless.js,581.
Tell HN: Digital Ocean has run out of GPU droplets,item?id=47249736,582.
Show HN: Logira – eBPF runtime auditing for AI agent runs,https://github.com/melonattacker/logira,583.
Attacker can bypass cryptography and prove mathematically impossible statements,https://osec.io/blog/2026-03-03-zkvms-unfaithful-claims/,584.
US and allied missile stockpiles 'bare' as Iran war heads into weeks,https://www.news.com.au/world/middle-east/us-and-allied-missile-stockpiles-bare-as-iran-war-heads-into-weeks/news-story/4232a54fb17b00688b8d7d6e4f0e4280,585.
Leaving Google has actively improved my life,https://pseudosingleton.com/leaving-google-improved-my-life/,586.
"Ask HN: If your project is free, what are you building and why keep it free?",item?id=47249560,587.
Show HN: Explain Curl Commands,https://github.com/akgitrepos/explain-my-curl,588.
GitHub having issues [resolved],https://www.githubstatus.com/incidents/n07yy1bk6kc4,589.
Otters as Bioindicators of Estuarine Health,https://emt.pensoft.net/article/185117/,590.
Regulator contacts Meta over workers watching intimate AI glasses videos,https://www.bbc.com/news/articles/c0q33nvj0qpo,591.
CBP Tapped into the Online Advertising Ecosystem to Track Peoples' Movements,https://lwn.net/Articles/1061085/,592.
"Show HN: Try Archetype 360 – AI‑powered personality test, 3× deeper than MBTI",https://archetype360.app/,593.
"2x Qwen 3.5 on M1 Mac: 9B builds a bot, 0.8B runs it",https://advanced-stack.com/fields-notes/qwen35-opencode-lm-studio-agentic-coding-on-m1.html,594.
OpenClaw surpasses React to become the most-starred software project on GitHub,https://www.star-history.com/blog/openclaw-surpasses-react-most-starred-software,595.
Gemini encouraged a man to commit suicide to be with his AI wife in theafterlife,https://www.engadget.com/ai/gemini-encouraged-a-man-commit-suicide-to-be-with-his-ai-wife-in-the-afterlife-lawsuit-alleges-153348434.html,596.
MrBeast Is Getting into Financial Services. Parents Should Pay Attention,https://www.nytimes.com/2026/03/03/business/mrbeast-step-banking-crypto.html,597.
YC Controls the Frame: Sam Altman's VC Advisors' Protocol Leaked [video],https://www.youtube.com/watch?v=pjO2_UWhlKA,598.
Lock Scroll with a Vengeance,https://unsung.aresluna.org/lock-scroll-with-a-vengeance/,599.
The Life Cycle of Money,https://doap.metal.bohyen.space/blog/post/complete-life-cycle-of-money/,600.
Simplenote is no longer in active development,https://forums.simplenote.com/forums/topic/customer-update-on-simplenote/?view=all,601.
ChatGPT Health fails to recognise medical emergencies – study,https://www.theguardian.com/technology/2026/feb/26/chatgpt-health-fails-recognise-medical-emergencies,602.
M5 Pro and M5 Max are surprisingly big departures from older Apple Silicon,https://arstechnica.com/gadgets/2026/03/m5-pro-and-m5-max-are-surprisingly-big-departures-from-older-apple-silicon/,603.
The Mini PET 40/80 (2022),http://blog.tynemouthsoftware.co.uk/2022/02/the-mini-pet-4080.html,604.
"Samsung Galaxy update removes Android recovery menu tools, including sideloading",https://9to5google.com/2026/02/27/samsung-galaxy-update-android-recovery-menu-removed/,605.
My perfect Music app doesn't exist,https://hicks.design/journal/my-perfect-music-app-doesnt-exist,606.
AI is a tool. Don't try to make it a teammate,https://www.xfive.co/blog/ai-is-a-tool-not-a-teammate,607.
Show HN: Term-CLI – interactive terminals for AI agents (for SSH/TUI/REPL flows),https://github.com/EliasOenal/term-cli,608.
"An AI agent coding skeptic tries AI agent coding, in excessive detail",https://minimaxir.com/2026/02/ai-agent-coding/,609.
An interactive intro to Elliptic Curve Cryptography,https://growingswe.com/blog/elliptic-curve-cryptography,610.
Palantir and other tech companies are stocking offices with tobacco products,https://fortune.com/2026/03/04/palantir-tech-companies-offices-vending-machines-tobacco-worker-productivity/,611.
Scientists study comet 3I/ATLAS to understand material from other star systems,https://comuniq.xyz/post?t=838,612.
Apple debuts M5 Pro and M5 Max to supercharge the most demanding pro workflows,https://www.apple.com/newsroom/2026/03/apple-debuts-m5-pro-and-m5-max-to-supercharge-the-most-demanding-pro-workflows/,613.
Xous security focused open source on 22nm custom silicon,https://www.crowdsupply.com/sutajio-kosagi/precursor/updates/xous-0-10-0-introducing-baochip-1x-support,614.
Monitor the Situation,https://monitor-the-situation.com/middle-east,615.
Federal judge rules: AI queries not protected from subpoenas/warrants,https://www.paulweiss.com/insights/client-memos/sdny-court-considers-whether-ai-generated-documents-are-subject-to-privilege-protections,616.
Have your cake and decompress it too,https://spiraldb.com/post/cascading-compression-with-btrblocks,617.
CPU scam: Chuwi CoreBook X uses AMD Ryzen 5 5500U instead of 7430U,https://www.notebookcheck.net/CPU-scam-Chuwi-CoreBook-X-uses-AMD-Ryzen-5-5500U-instead-of-7430U.1242048.0.html,618.
Windows 98 Disk Defrag Simulator,https://defrag98.com/,619.
Claude's Cycles [pdf],https://cs.stanford.edu/~knuth/papers/claude-cycles.pdf,620.
"Dear Meta Smart Glasses Wearers: You're Being Watched, Too",https://gizmodo.com/dear-meta-smart-glasses-wearers-youre-being-watched-too-2000728928,621.
"Flock license plate readers cost city big, deliver little",https://www.sandiegouniontribune.com/2026/02/28/flock-license-plate-readers-cost-city-big-deliver-litte/,622.
Rust 1.94.0,https://blog.rust-lang.org/2026/03/05/Rust-1.94.0/,623.
"Downdetector, Speedtest sold to IT service provider Accenture in $1.2B deal",https://arstechnica.com/information-technology/2026/03/downdetector-speedtest-sold-to-it-service-provider-accenture-in-1-2b-deal/,624.
FBI stymied by Apple's Lockdown Mode after seizing journalist's iPhone,https://arstechnica.com/tech-policy/2026/02/fbi-stymied-by-apples-lockdown-mode-after-seizing-journalists-iphone/,625.
Eurosky.social accounts – launching early February,https://www.eurosky.tech/register,626.
I keep building projects nobody wants. So this time I'm doing it backwards,item?id=47266253,627.
What's new in Linux kernel for PostgreSQL,https://erthalion.info/2026/02/03/new-linux-for-postgresql/,628.
"EEmicroGPT: 19,000× faster microgpt training on a laptop CPU (loss vs. time)",https://entrpi.github.io/eemicrogpt/,629.
DRAM bots being deployed to hoover up memory chips and components,https://www.tomshardware.com/pc-components/dram/dram-bots-reportedly-being-deployed-to-hoover-up-memory-chips-and-components-one-operation-ran-10-million-web-scraping-requests-hitting-ddr5-ram-product-pages-every-6-5-seconds,630.
Ex-NYPD Official Indicted for Accepting Bribes from Tech Exec,https://www.thecity.nyc/2026/02/12/kevin-taylor-phil-david-terence-banks-saferwatch-indictment/,631.
How the Government Deceived Congress in the Debate over Surveillance Powers (2013),https://www.eff.org/deeplinks/2013/06/director-national-intelligences-word-games-explained-how-government-deceived,632.
ChatGPT uninstalls surged by 295% after DoD deal,https://techcrunch.com/2026/03/02/chatgpt-uninstalls-surged-by-295-after-dod-deal/,633.
The Lobster Programming Language,https://strlen.com/lobster/,634.
China ramps up 'high stakes' tech race with US as economic imbalances deepen,https://www.reuters.com/world/china/china-parliament-approve-growth-policy-plans-amid-growing-us-rivalry-2026-03-04/,635.
A simplified guide to TRS MIDI,https://minimidi.world/,636.
Ask HN: What sources like HN do you consume?,item?id=47215609,637.
CPU scam: Chuwi CoreBook X uses AMD Ryzen 5 5500U instead of 7430U,https://www.notebookcheck.net/CPU-scam-Chuwi-CoreBook-X-uses-AMD-Ryzen-5-5500U-instead-of-7430U.1242048.0.html,638.
