Title,Link,Rank
Sam Altman Admits OpenAI Can't Control Pentagon's Use of AI,https://www.theguardian.com/technology/2026/mar/04/sam-altman-openai-pentagon,639.
Who really invented television?,https://www.nationalgeographic.com/history/article/invention-television-tv-baird,640.
Evolving descriptive text of mental content from human brain activity,https://www.bbc.com/future/article/20260226-how-ai-can-read-your-thoughts,641.
A Race Within a Race: Exploiting CVE-2025-38617 in Linux Packet Sockets,https://blog.calif.io/p/a-race-within-a-race-exploiting-cve,642.
"Altman takes jab at Anthropic, says gov't should be more powerful than companies",item?id=47264228,643.
Congress Is Considering Abolishing Your Right to Be Anonymous Online,https://theintercept.com/2026/03/05/kosa-online-age-verification-free-speech-privacy/,644.
Upside Robotics is reducing fertilizer use and waste in corn crops,https://techcrunch.com/2026/02/11/upside-robotics-is-reducing-fertilizer-use-and-waste-in-corn-crops/,645.
"Show HN: SQLite for Rivet Actors – one database per agent, tenant, or document",https://github.com/rivet-dev/rivet,646.
"Emuko: Fast RISC-V emulator written in Rust, boots Linux",https://github.com/wkoszek/emuko,647.
OpenPencil – AI-native design editor. Open-source Figma alternative,https://github.com/open-pencil/open-pencil,648.
I am directing the Department of War to designate Anthropic a supply-chain risk,https://twitter.com/secwar/status/2027507717469049070,649.
The Glaring Oversight in the U.S. War Plan,https://www.theatlantic.com/national-security/2026/03/iran-war-drones-ukraine-pentagon/686249/,650.
A rabbi is overseeing Pornhub. That's not so weird – The Forward,https://forward.com/culture/654804/pornhub-rabbi-solomon-friedman-jewish/,651.
I built an RGB controller with Arduino,https://svana.name/2026/02/i-built-an-rgb-controller-with-arduino/,652.
Silent Backwards Compatibility Breaking Changes in PyTorch,https://blog.ezyang.com/2026/03/silent-bc-breaking-changes/,653.
Operational issue – Multiple services (UAE),https://health.aws.amazon.com/health/status,654.
Legal AI slop is becoming a real problem,https://www.ctinsider.com/connecticut/article/supreme-court-ai-cases-middletown-21950447.php,655.
"Show HN: I built a zero-browser, pure-JS typesetting engine for bit-perfect PDFs",https://github.com/cosmiciron/vmprint,656.
IOC announces principles of neutrality during aggression against Iran,https://www.olympics.com/ioc/news/ioc-statement-on-athletes-safe-passage,657.
The Robotic Dexterity Deadlock,https://www.origami-robotics.com/blog/dexterity-deadlocks.html,658.
OpenAI – How to delete your account,https://help.openai.com/en/articles/6378407-how-to-delete-your-account,659.
"Washington Post – In the Long Run, Wars Make Us Safer and Richer (2014)",https://www.washingtonpost.com/opinions/in-the-long-run-wars-make-us-safer-and-richer/2014/04/25/a4207660-c965-11e3-a75e-463587891b57_story.html,660.
Full-Stack Dev's Internal Thought Process,https://www.youtube.com/watch?v=xE9W9Ghe4Jk,661.
Ohio EPA weighs allowing data centers to dump wastewater into rivers,https://www.nbc4i.com/news/local-news/columbus/ohio-epa-weighs-allowing-data-centers-to-release-wastewater-into-rivers/,662.
What AI coding costs you,https://tomwojcik.com/posts/2026-02-15/finding-the-right-amount-of-ai/,663.
Computer run on human brain cells learned to play 'Doom',https://www.popsci.com/technology/human-brain-cell-computer-plays-doom/,664.
"Tesla loses Toyota and Stellantis from EU CO2 pool, taking billions with them",https://electrek.co/2026/03/03/toyota-stellantis-withdraw-tesla-co2-pool-europe/,665.
I lost my ability to learn anything new because of AI and I need your opinions,item?id=47240612,666.
Sneak peek at the redesigned Stack Overflow,https://stackoverflow.blog/2026/02/25/your-sneak-peek-at-the-redesigned-stack-overflow/,667.
Show HN: Sai – Your always-on co-worker,https://www.simular.ai/sai,668.
Entry-level PC market to 'disappear' by 2028 – memory prices strain PC market,https://www.tomshardware.com/tech-industry/rising-memory-prices-pile-more-strain-on-consumer-pc-market,669.
Inferring car movement patterns from passive TPMS measurements,https://dspace.networks.imdea.org/handle/20.500.12761/2011,670.
The Ada Lovelace Fable,https://twitter.com/gtredoux/status/2029300803144696309,671.
"Everything Changes, and Nothing Changes",https://btao.org/posts/2026-02-28-everything-changes-nothing-changes/,672.
Cancer blood tests are everywhere. Do they work?,https://www.nature.com/articles/d41586-026-00661-2,673.
Salt of the Earth: Underground Salt Caverns Just Might Power Our Future,https://eos.org/features/salt-of-the-earth-vast-underground-salt-caverns-are-preserving-our-history-and-just-might-power-our-future,674.
Gemini 3.1 Flash-Lite: Built for intelligence at scale,https://blog.google/innovation-and-ai/models-and-research/gemini-models/gemini-3-1-flash-lite/,675.
Show HN: Gitcredits – movie-style end credits for any Git repo in your terminal,https://github.com/Higangssh/gitcredits,676.
The Looming AI Clownpocalypse,https://honnibal.dev/blog/clownpocalypse,677.
The US is using repurposed Iranian drone technology to attack Iran,https://theconversation.com/the-us-is-using-repurposed-iranian-drone-technology-to-attack-iran-a-military-expert-explains-why-277397,678.
Neither Android nor iOS: DIY Smartphone Runs on ESP32,https://hackaday.com/2026/03/04/neither-android-nor-ios-diy-smartphone-runs-on-esp32/,679.
Japan Radio Begins 24-Hour Shortwave Transmission in Response to Iran Attacks [pdf],https://www3.nhk.or.jp/nhkworld/upld/thumbnails/en/information/nhk_world-japan_radio_begins_temporary_shortwave_transmission.pdf,680.
Working and Communicating with Japanese Engineers,https://www.tokyodev.com/articles/working-and-communicating-with-japanese-engineers,681.
Microsoft Shipped Pirated Harry Potter Books on Their Blog for 14 Months,https://chaosguru.substack.com/p/good-hygiene-starts-on-day-one-not,682.
Drinking newer groundwater linked to up to 62% higher Parkinson's risk,https://www.newsweek.com/one-type-of-drinking-water-linked-to-up-to-62-higher-parkinsons-risk-11603834,683.
"January in Servo: preloads, better forms, details styling, and more",https://servo.org/blog/2026/02/28/january-in-servo/,684.
Ask HN: What's your experience self-hosting in 2026?,item?id=47238601,685.
Copilot Memory now on by default for Pro and Pro+ users in public preview,https://github.blog/changelog/2026-03-04-copilot-memory-now-on-by-default-for-pro-and-pro-users-in-public-preview/,686.
Show HN: Vibe Code your 3D Models,https://github.com/ierror/synaps-cad,687.
"Ketamine may fight chronic fatigue, study suggests",https://medicalxpress.com/news/2026-02-ketamine-chronic-fatigue.html,688.
"My AI Agents Lie About Their Status, So I Built a Hidden Monitor",https://kaylarosemathisen.substack.com/p/my-ai-agents-lie-about-their-status,689.
To update blobs or not to update blobs,https://codon.org.uk/~mjg59/blog/p/to-update-blobs-or-not-to-update-blobs/,690.
"Theory of Constraints: ""Blue Light"" creating capacity for nothing (2007)",http://theoryofconstraints.blogspot.com/2007/06/toc-stories-2-blue-light-creating.html,691.
LexisNexis confirms data breach as hackers leak stolen files,https://www.bleepingcomputer.com/news/security/lexisnexis-confirms-data-breach-as-hackers-leak-stolen-files/,692.
Can Europe break free of Visa and Mastercard? MEPs stall digital euro,https://www.euronews.com/my-europe/2026/02/27/can-europe-break-free-of-visa-and-mastercard-meps-stall-digital-euro,693.
"Dan Simmons, author of Hyperion, has died",https://www.dignitymemorial.com/obituaries/longmont-co/daniel-simmons-12758871,694.
BM25,https://arpitbhayani.me/blogs/bm25/,695.
OpenWrt 25.12.0 â€“ Stable Release,https://openwrt.org/releases/25.12/notes-25.12.0,696.
Florida public universities to pause hiring new H-1B workers,https://www.wusf.org/education/2026-03-03/hiring-h1b-workers-florida-public-universities-pause-end-of-year,697.
"Ask HN: Maintainers, do LLM-only users often clutter your issues/PRs?",item?id=47250497,698.
TerraPower gets OK to start construction of its first nuclear plant,https://arstechnica.com/science/2026/03/terrapower-gets-ok-to-start-construction-of-its-first-nuclear-plant/,699.
The AI Bubble Is an Information War,https://www.wheresyoured.at/the-ai-bubble-is-an-information-war/,700.
Haida Salmon Restoration Corporation,https://en.wikipedia.org/wiki/Haida_Salmon_Restoration_Corporation,701.
Show HN: Punch card simulator and Fortran IV interpreter,https://punch.ehrlich.dev/,702.
The Power Brokers Behind the $250B Influencer Economy,https://www.wsj.com/lifestyle/careers/uta-influencer-managers-ali-berman-raina-penchansky-alix-earle-5094867f,703.
Why machine identities now drive trust in banking,https://www.cyberark.com/resources/blog/the-new-ai-access-problem-why-machine-identities-now-drive-trust-in-banking,704.
"Dr. Jebra Faushay: ""The 80s: You Just Had to Be There""",https://twitter.com/JebraFaushay/status/2015608814385402024,705.
Trump says US will have a role in choosing Iran's next leader,https://www.reuters.com/world/iran-live-war-widens-iran-says-us-will-bitterly-regret-sinking-ship-2026-03-05/,706.
Running a One Trillion-Parameter LLM Locally on AMD Ryzen AI Max+ Cluster,https://www.amd.com/en/developer/resources/technical-articles/2026/how-to-run-a-one-trillion-parameter-llm-locally-an-amd.html,707.
Show HN: Ledge - Policy layer for AI agent payments (prevents unauthorized txns),https://github.com/Devendra116/ledge,708.
AI Safety Farce,https://seanpedersen.github.io/posts/ai-safety-farce/,709.
How does B-tree make your queries fast?,https://blog.allegro.tech/2023/11/how-does-btree-make-your-queries-fast.html,710.
The Worst Language Won,https://theoryvc.com/blog-posts/the-worst-language-won,711.
Cursor for academic writing (open source),https://github.com/octree-labs/octree,712.
OCC Joins Fed Push to Trim Supervisory Red Flags Issued to Banks,https://news.bloomberglaw.com/banking-law/occ-joins-fed-push-to-trim-supervisory-red-flags-issued-to-banks,713.
Pentagon chief blocks officers from Ivy League schools and top universities,https://fortune.com/2026/02/28/pentagon-officer-education-ivy-league-schools-universities-partners-ai-space/,714.
Iranian strikes on Amazon data centers highlight industry's vulnerability,https://www.sfgate.com/news/world/article/iranian-strikes-on-amazon-data-centers-highlights-21952805.php,715.
Codex app now available on Windows,https://developers.openai.com/codex/app/windows/,716.
Vibe coded Lovable-hosted app littered with basic flaws exposed 18K users,https://www.theregister.com/2026/02/27/lovable_app_vulnerabilities/,717.
The uncomfortable truth about getting people off US tech,https://blog.dougbelshaw.com/getting-off-us-tech/,718.
Ask HN: What will OpenAI employees do now who have signed notdividedorg petition,item?id=47231498,719.
Clawed,https://www.hyperdimensional.co/p/clawed,720.
"EUrouter – Integrate the latest AI models, without sending data outside the EU",https://www.eurouter.ai,721.
The most-seen UI on the internet? Redesigning turnstile and challenge pages,https://blog.cloudflare.com/the-most-seen-ui-on-the-internet-redesigning-turnstile-and-challenge-pages/,722.
How Talks Between Anthropic and the Defense Dept. Fell Apart,https://www.nytimes.com/2026/03/01/technology/anthropic-defense-dept-openai-talks.html,723.
Just two days of oatmeal cut bad cholesterol by 10%,https://www.sciencedaily.com/releases/2026/02/260225081217.htm,724.
Zuckerberg's internal emails rendered as Facebook Messenger,https://zuckmail.vercel.app/,725.
Internals of a Key-Value Store Built on SQLite's B-Tree Engine,https://hash-anu.github.io/snkv/,726.
Apple Blocks US Users from Downloading ByteDance's Chinese Apps,https://www.wired.com/story/bytedance-apps-are-no-longer-available-in-us-app-stores/,727.
Show HN: A Puzzle Game Based on Non-Commutative Operations,https://commutators.games,728.
EFF to Court: Don't Make Embedding Illegal,https://www.eff.org/deeplinks/2026/03/eff-court-dont-make-embedding-illegal,729.
FCC Chair Wants Networks to Pledge Loyalty for America's Big Bday,https://gizmodo.com/trumps-fcc-chair-wants-networks-to-run-nationalistic-content-and-pledge-loyalty-for-americas-big-bday-2000725152,730.
"Mac external displays for designers and developers, part 2 (2022)",https://bjango.com/articles/macexternaldisplays2/,731.
Iranian strikes test the Gulf's trillion-dollar AI dream,https://restofworld.org/2026/amazon-uae-data-center-fire-iran-strike/,732.
"The unfortunate need for an ""age verification"" API for legal compliance",https://lists.ubuntu.com/archives/ubuntu-devel/2026-March/043510.html,733.
Underground Salt Caverns Are Preserving Our History,https://eos.org/features/salt-of-the-earth-vast-underground-salt-caverns-are-preserving-our-history-and-just-might-power-our-future,734.
Should I Block Ads?,https://shouldiblockads.com/,735.
"FTC Admits Age Verification Violates Children's Privacy Law, Ignores That Fact",https://www.techdirt.com/2026/03/04/ftc-admits-age-verification-violates-childrens-privacy-law-decides-to-just-ignore-that/,736.
Anna's Archive Loses .LI Domain as Legal Pressure Mounts,https://torrentfreak.com/annas-archive-loses-li-domain-as-legal-pressure-mounts/,737.
The Optimization Trap: Why the Birth Rate Can't Be Fixed,https://tantaman.com/2026-03-02-fertility-is-not-economics.html,738.
Triplet Superconductor,https://www.sciencedaily.com/releases/2026/02/260221000252.htm,739.
Show HN: Xpandas – running Pandas-style computation directly in pure C++,item?id=47215037,740.
Bluesky adds (broken) age verification,https://bsky.app,741.
Debunking the Myth of a Unified China-Russia: Threat Review,https://www.armscontrol.org/act/2026-03/features/debunking-myth-unified-china-russia-threat,742.
Ask HN: What Online LLM / Chat do you use?,item?id=47227046,743.
Evil in the West Bank,https://www.nybooks.com/articles/2026/03/12/evil-in-the-west-bank-david-shulman/,744.
"LibreOffice hits back at critics, says its UI is better than Microsoft Office's",https://www.neowin.net/news/libreoffice-hits-back-at-its-critics-says-its-ui-is-better-than-microsoft-offices/,745.
AI is unhealthy in a variety of different ways,https://www.computerworld.com/article/4138046/people-are-getting-sick-of-ai-literally.html,746.
Anthropic Nears $20B Revenue Run Rate Amid Pentagon Feud,https://www.bloomberg.com/news/articles/2026-03-03/anthropic-nears-20-billion-revenue-run-rate-amid-pentagon-feud,747.
Oracle Plans Job Cuts in Face of AI Cash Crunch,https://www.bloomberg.com/news/articles/2026-03-05/oracle-layoffs-to-impact-thousands-in-ai-cash-crunch,748.
"""All Lawful Use"": More Than You Wanted to Know",https://www.astralcodexten.com/p/all-lawful-use-much-more-than-you,749.
Urgent: Write the FCC to Oppose SpaceX and Reflect Orbital Plans,https://www.nakedcapitalism.com/2026/03/urgent-please-write-the-fcc-to-oppose-latest-spacex-world-changing-plan-massively-light-polluting-reflect-orbital-satellites-which-will-end-the-night-sky.html,750.
"Deutschland-Stack: Open-Source Alliance Warns of ""Sovereignty Washing""",https://www.heise.de/en/news/Deutschland-Stack-Open-Source-Alliance-warns-of-Sovereignty-Washing-11178965.html,751.
Left-Handers Are More Competitive Than Right-Handers,https://www.psychologytoday.com/us/blog/the-asymmetric-brain/202602/left-handers-are-more-competitive-than-right-handers,752.
Linux Signalfd Is Useless,https://ldpreload.com/blog/signalfd-is-useless,753.
Rhode Island Files First-in-Nation Single-Room Occupancy Model Legislation,https://ij.org/press-release/rhode-island-files-first-in-nation-single-room-occupancy-model-legislation-room-act-to-combat-housing-crisis/,754.
Cancel ChatGPT AI boycott surges after OpenAI pentagon military deal,https://www.euronews.com/next/2026/03/02/cancel-chatgpt-ai-boycott-surges-after-openai-pentagon-military-deal,755.
Yahoo Scout Beta,https://scout.yahoo.com,756.
Stop Looking at Economic Averages,https://troytassier.substack.com/p/stop-looking-at-economic-averages,757.
"NASA chatbots, Treasury coding, OPM drafting: How agencies have deployed Claude",https://fedscoop.com/nasa-chatbots-treasury-coding-opm-drafting-agencies-deployed-claude/,758.
Show HN: Writing App for Novelist,https://novelos.studio/,759.
Setting up OpenClaw on a cloud VM,https://blog.skypilot.co/openclaw-on-skypilot/,760.
Good News: AI Will Eat Application Software,https://a16z.com/good-news-ai-will-eat-application-software/,761.
The AI Surveillance Debate Is Missing the Most Dangerous Part,https://weaponizedspaces.substack.com/p/the-ai-surveillance-debate-is-missing,762.
"Open PDF Studio: A free, open-source PDF editor and annotator",https://github.com/OpenAEC-Foundation/open-pdf-studio,763.
Pentagon head to military officers: You cannot study in these 22 universities,https://timesofindia.indiatimes.com/technology/tech-news/pentagon-head-to-military-officers-you-cannot-study-in-these-22-universities-across-the-world-see-full-list/articleshow/128910201.cms,764.
Erfurt Latrine Disaster,https://en.wikipedia.org/wiki/Erfurt_latrine_disaster,765.
Geran-3 Drone Disassembly,https://war-sanctions.gur.gov.ua/en/page-geran-3,766.
White House stalls release of approved US science budgets,https://www.nature.com/articles/d41586-026-00601-0,767.
MiniMax M2.5 is beating Claude Opus 4.6 and MiniMax is 17x-20x cheaper,https://www.swebench.com/,768.
"4,500 Physicians Agree (About Bacon)",https://machielreyneke.com/blog/persuasion/,769.
Resist 'dangerous and socially unacceptable' age checks for social media,https://www.politico.eu/article/age-check-social-media-scientist-warning/,770.
Show HN: Xmloxide – an agent-made Rust replacement for libxml2,https://github.com/jonwiggins/xmloxide,771.
Device that can extract 1K liters of clean water a day from desert air revealed,https://www.tomshardware.com/tech-industry/device-that-can-extract-1-000-liters-of-clean-water-a-day-from-desert-air-revealed-by-2025-nobel-prize-winner-claimed-to-work-in-desert-air-with-20-percent-humidity-or-lower-delivering-off-grid-personalized-water,772.
Tell HN: I got Claude Max for my open source project,item?id=47244173,773.
Malus: Clean room engineering of any open-source dependency,https://malus.sh/blog.html,774.
"Facing Its Third Data Center, an Iowa County Rolls Out Extensive Zoning Rules",https://insideclimatenews.org/news/01032026/iowa-county-data-center-ordinance/,775.
Payment fees matter more than you think,https://cuencahighlife.com/why-payment-fees-matter-more-than-you-think/,776.
Welcome to the Wasteland: A Thousand Gas Towns,https://steve-yegge.medium.com/welcome-to-the-wasteland-a-thousand-gas-towns-a5eb9bc8dc1f,777.
Islets – The Spatial CMS,https://islets.app,778.
Show HN: Tomoshibi – A writing app where your words fade by firelight,https://tomoshibi.in-hakumei.com/,779.
"YggTorrent Shuts Down After Hack, Leak and Stolen Crypto",https://torrentfreak.com/yggtorrent-shuts-down-after-hack-leak-and-stolen-crypto/,780.
"When I lost my university email, my identity as scientist took an unexpected hit",https://www.science.org/content/article/when-i-lost-my-university-email-my-identity-scientist-took-unexpected-hit,781.
"Ow My Foot – Error Handling Across C, Go, Rust, and Google's Absl",https://n8z.dev/posts/ow-my-foot/,782.
Claude Code rolls out a voice mode capability,https://techcrunch.com/2026/03/03/claude-code-rolls-out-a-voice-mode-capability/,783.
"Show HN: Decided to play god this morning, so I built an agent civilisation",https://github.com/nocodemf/werld,784.
Sam Altman admits OpenAI can't control Pentagon's use of AI,https://www.theguardian.com/technology/2026/mar/04/sam-altman-openai-pentagon,785.
"We may soon have 70M boomers too old to drive, too car-dependent to stop",https://lloydalter.substack.com/p/we-may-soon-have-70-million-boomers,786.
"Show HN: Tradefacts.io – US HTS tariff schedule, a JSON API and change detection",https://tradefacts.io,787.
"Show HN: Atrium – An open-source, self-hosted client portal",https://github.com/Vibra-Labs/Atrium,788.
Major data leak forum dismantled in international cybercrime operation,https://www.europol.europa.eu/media-press/newsroom/news/major-data-leak-forum-dismantled-in-global-action-against-cybercrime-forum,789.
Four months of Ruby Central moving Ruby backward,https://andre.arko.net/2026/03/03/four-months-of-ruby-central-moving-ruby-backward/,790.
"Show HN: The Silent Filter, The Delegation of Synthesis and Linguistic Drift",https://juanpabloaj.com/2026/02/27/the-silent-filter/,791.
Allegations of insider trading over prediction-market bets tied to Iran conflict,https://www.morningstar.com/news/marketwatch/20260301140/allegations-of-insider-trading-over-prediction-market-bets-tied-to-iran-conflict,792.
RTINGS: Revamping Our Membership Program,https://www.rtings.com/company/revamping-our-membership-program,793.
Ask HN: Would engineers be interested in a technical prep consultant?,item?id=47224051,794.
The LLM Sycophancy Antidote,https://photostructure.com/coding/sycophancy-antidote/,795.
Anthropic Adds Free Memory Feature and Import Tool to Lure ChatGPT Users,https://www.macrumors.com/2026/03/02/anthropic-memory-import-tool/,796.
How OpenAI caved to The Pentagon on AI surveillance,https://www.theverge.com/ai-artificial-intelligence/887309/openai-anthropic-dod-military-pentagon-contract-sam-altman-hegseth,797.
How do I cancel my ChatGPT subscription?,https://help.openai.com/en/articles/7232927-how-do-i-cancel-my-chatgpt-subscription,798.
Polymarket and Kalshi's Iran War Wagers Are Ghoulish – and Troubling,https://www.bloomberg.com/opinion/articles/2026-03-04/prediction-markets-polymarket-kalshi-iran-war-wagers-are-troubling,799.
XPrivo Search: Europe's 100% Data Sovereign Search Engine,https://www.xprivo.com/blog/en/european-search-engine-launch/,800.
Whats Up with Claude Lately?,item?id=47227740,801.
Why was the Commodore 64 disk drive so slow?,https://imrannazar.com/articles/commodore-1541,802.
Mexico Mandates Biometric SIM Registration for All Phone Numbers,https://reclaimthenet.org/mexico-mandates-biometric-sim-registration-for-all-phone-numbers,803.
CIA Station Hit in Drone Attack,https://www.washingtonpost.com/national-security/2026/03/03/cia-saudi-arabia-drone-attack-iran/,804.
CSP for Pentesters: Understanding the Fundamentals,https://www.kayssel.com/newsletter/issue-20/,805.
LibreOffice Online dragged out of the attic,https://www.theregister.com/2026/03/02/libreoffice_online_deatticized/,806.
A survey of write protect notches on floppy disks and other media,https://devblogs.microsoft.com/oldnewthing/20260303-00/?p=112104,807.
Loreline: Modern and open-source language for writing interactive fiction,https://loreline.app/en/,808.
Microgpt explained interactively,https://growingswe.com/blog/microgpt,809.
Blind refugee found dead in NY after being released by immigration authorities,https://www.bbc.com/news/articles/cq57j559eq4o,810.
Ask HN: Who still works async and has a 'no meetings' work policy in 2026?,item?id=47230618,811.
Show HN: Visualize Git commit histories as animated force-directed graphs,https://github.com/nshcr/git-commits-threadline,812.
"President Trump, Pam Bondi sued over sale of TikTok assets",https://www.npr.org/2026/03/05/g-s1-112605/tiktok-deal-lawsuit-trump-bondi,813.
It's official: Hiring managers aren't reading your Résumé,https://www.businessinsider.com/hiring-managers-arent-reading-resumes-slop-2026-3,814.
Show HN: I built a dashboard to track AI's impact on jobs,https://www.clocktick.ai/,815.
Lego's New Tech-Packed Smart Brick,https://www.wired.com/story/exclusive-inside-look-at-new-lego-smart-brick/,816.
OpenWRT 25.12.0 Released,https://openwrt.org/releases/25.12/notes-25.12.0,817.
"390TB video game archive being taken offline due to skyrocketing RAM, SSD",https://www.tomshardware.com/video-games/390tb-video-game-archive-being-taken-offline-due-to-skyrocketing-ram-ssd-and-hard-drive-prices-ai-driven-supply-squeeze-results-in-closure-of-one-of-the-largest-online-video-game-archives,818.
OpenAI is working on its own GitHub competitor,https://www.neowin.net/news/openai-is-reportedly-working-on-its-own-github-competitor/,819.
Trump rejects Khamenei's son as Iran war intensifies with US-Israel strikes,https://www.reuters.com/world/asia-pacific/iran-launches-wave-missiles-israel-us-republicans-block-measure-halt-us-air-2026-03-05/,820.
Three scientists who said no to Epstein,https://www.science.org/content/article/meet-three-scientists-who-said-no-epstein,821.
Offline 23 Hours a Day,https://sive.rs/off23,822.
"Show HN: Reclaim Flowers – A 2D physics-based ""Digital Altar"" protocol",https://github.com/voice-of-japan/Virtual-Protest-Protocol/blob/main/README.md,823.
Civis Romanus Sum,https://minutes.substack.com/p/civis-romanus-sum,824.
"$82,000 in 48 Hours from stolen Gemini API Key vs. normal monthly Usage Of $180",https://old.reddit.com/r/googlecloud/comments/1reqtvi/82000_in_48_hours_from_stolen_gemini_api_key_my/,825.
France Floats Nuclear Deployment Across Europe,https://www.wsj.com/world/europe/france-floats-nuclear-deployment-across-europe-056a5cbc,826.
Ubuntu is planning to comply with Age Verification law,https://old.reddit.com/r/linux/comments/1rk2th7/ubuntu_is_planning_to_comply_with_age/,827.
Secure LLM Scripting. Finally,https://mlld.ai/,828.
Cards Against Humanity Statement and Form for Tariff Refunds,https://www.getyourfuckingmoneyback.com/,829.
"Show HN: BananaOS, vibecoded operating system that boots on a 486 with ~11MB RAM",item?id=47183215,830.
Ask HN: What prompt do you use to get Claude to consistently render LaTeX?,item?id=47238785,831.
Helsinki just went a full year without a single traffic death,https://www.politico.eu/article/helsinki-no-traffic-death-roads-eu-accident-finland-driving-transport/,832.
