Title,Link,Rank
Show HN: A shell-native cd-compatible directory jumper using power-law frecency,https://github.com/jghub/sd-switchdir,225.
Computer scientists caution against internet age-verification mandates,https://reason.com/2026/03/04/computer-scientists-caution-against-internet-age-verification-mandates/,226.
Welcoming Elizabeth Barron as the New Executive Director of the PHP Foundation,https://thephp.foundation/blog/2026/02/27/welcoming-elizabeth-barron-new-executive-director/,227.
Medical journal says the case reports it has published for 25 years are fiction,https://retractionwatch.com/2026/03/03/canadian-pediatric-society-journal-correction-case-reports-fictional-paediatrics-child-health/,228.
Guilty Displeasures,https://www.hopefulmons.com/p/what-are-your-guilty-displeasures,229.
Computer Says No,https://koenvangilst.nl/lab/computer-says-no,230.
Notes on Project Oberon,https://sidhion.com/blog/oberon_notes/,231.
"AI companies aim 'not to help workers, but to replace them'",https://www.vaticannews.va/en/world/news/2026-03/ai-threats-religion-william-jones-future-humanity.html,232.
DOS Memory Management,https://www.os2museum.com/wp/dos-memory-management/,233.
Why Objective-C,https://inessential.com/2026/02/27/why-objective-c.html,234.
Arm's Cortex X925: Reaching Desktop Performance,https://chipsandcheese.com/p/arms-cortex-x925-reaching-desktop,235.
Cloudflare rewrites Next.js as AI rewrites commercial open source,https://newsletter.pragmaticengineer.com/p/the-pulse-cloudflare-rewrites-nextjs,236.
How to talk to anyone and why you should,https://www.theguardian.com/lifeandstyle/2026/feb/24/stranger-secret-how-to-talk-to-anyone-why-you-should,237.
"Show HN: Timber – Ollama for classical ML models, 336x faster than Python",https://github.com/kossisoroyce/timber,238.
Sam Altman asks if government can nationalize artificial general intelligence,https://thenewstack.io/openai-defense-department-debate/,239.
The Space Race's Forgotten Theme Park,https://daily.jstor.org/the-space-races-forgotten-theme-park/,240.
Textadept,https://orbitalquark.github.io/textadept/,241.
The Pentagon Officially Notifies Anthropic That It Is a 'Supply Chain Risk',https://www.nytimes.com/2026/03/05/technology/anthropic-supply-chain-risk-defense-department.html,242.
Tech titans vow to 'take back' California,https://nypost.com/2026/03/05/us-news/tech-titans-vow-to-take-back-california-from-lefties-call-out-billionaires-fleeing/,243.
Greg Knauss Is Losing Himself,https://shapeof.com/archives/2026/2/greg_knauss_is_losing_himself.html,244.
Number Research Inc,https://numberresearch.xyz/,245.
First in-utero stem cell therapy for fetal spina bifida repair is safe: study,https://health.ucdavis.edu/news/headlines/first-ever-in-utero-stem-cell-therapy-for-fetal-spina-bifida-repair-is-safe-study-finds/2026/02,246.
Show HN: I built a sub-500ms latency voice agent from scratch,https://www.ntik.me/posts/voice-agent,247.
Nuclear War: An LLM Scenario,https://chrisclapham.com/blog/nuclear-war-an-llm-scenario,248.
Intel's make-or-break 18A process node debuts for data center with 288-core Xeon,https://www.tomshardware.com/pc-components/cpus/intels-make-or-break-18a-process-node-debuts-for-data-center-with-288-core-xeon-6-cpu-multi-chip-monster-sports-12-channels-of-ddr5-8000-foveros-direct-3d-packaging-tech,249.
U.S. Capabilities Are Showing Signs of Rot,https://www.theatlantic.com/ideas/2026/03/military-failures-trump-iran/686244/,250.
Mondrian Entered the Public Domain. The Estate Disagrees,https://copyrightlately.com/mondrian-public-domain-controversy/,251.
Apple Studio Display and Studio Display XDR,https://www.apple.com/newsroom/2026/03/apple-unveils-new-studio-display-and-all-new-studio-display-xdr/,252.
"Show HN: Omni – Open-source workplace search and chat, built on Postgres",https://github.com/getomnico/omni,253.
Seed of Might color correction process (2023) [pdf],https://andrewvanner.github.io/som/SoM_CC_Process_Day.pdf,254.
C64: Putting Sprite Multiplexing to Work,https://bumbershootsoft.wordpress.com/2026/02/28/c64-putting-sprite-multiplexing-to-work/,255.
Programmable Cryptography (2024),https://0xparc.org/writings/programmable-cryptography-1,256.
Blogosphere – a directory of independent blogs and personal websites,https://blogosphere.app/,257.
Completing the formal proof of higher-dimensional sphere packing,https://www.math.inc/sphere-packing,258.
Microplastics and nanoplastics in urban air originate mainly from tire abrasion,https://phys.org/news/2026-03-microplastics-nanoplastics-urban-air-abrasion.html,259.
The Cathode Ray Tube site,https://www.crtsite.com/didactic-crt.html,260.
Privacy-preserving age and identity verification via anonymous credentials,https://blog.cryptographyengineering.com/2026/03/02/anonymous-credentials-an-illustrated-primer/,261.
"New iPad Air, powered by M4",https://www.apple.com/newsroom/2026/03/apple-introduces-the-new-ipad-air-powered-by-m4/,262.
The largest acidic geyser has been putting on quite a show,https://www.usgs.gov/observatories/yvo/news/echinus-geyser-back-action-now,263.
Does that use a lot of energy?,https://hannahritchie.github.io/energy-use-comparisons/,264.
Bet on German Train Delays,https://bahn.bet,265.
Why does C have the best file API,https://maurycyz.com/misc/c_files/,266.
"If AI writes code, should the session be part of the commit?",https://github.com/mandel-macaque/memento,267.
Don't become an engineering manager,https://newsletter.manager.dev/p/dont-become-an-engineering-manager,268.
How to record and retrieve anything you've ever had to look up twice,https://ellanew.com/2026/03/02/ptpl-197-record-retrieve-from-a-personal-knowledgebase,269.
We do not think Anthropic should be designated as a supply chain risk,https://twitter.com/OpenAI/status/2027846016423321831,270.
Simple screw counter,https://mitxela.com/projects/screwcounter,271.
Once Upon a Boot - visual tracing of boot process,https://once-upon-a-boot.github.io/,272.
Guido van Rossum Interviews Thomas Wouters (Python Core Dev),https://gvanrossum.github.io/interviews/Thomas.html,273.
An Interactive Intro to CRDTs (2023),https://jakelazaroff.com/words/an-interactive-intro-to-crdts/,274.
Iranian Warship Did Not Carry Ammunition per Protocol of the Milan Exercises,https://old.reddit.com/r/UnderReportedNews/comments/1rlmsom/the_downed_iranian_warship_did_not_carry_any/,275.
Snapdragon ARM laptop overtakes Intel's flagship Panther Lake in benchmarks,https://www.pcguide.com/news/snapdragon-powered-arm-laptop-overtakes-intels-flagship-panther-lake-chip-in-early-benchmarks/,276.
Buckle Up for Bumpier Skies,https://www.newyorker.com/magazine/2026/03/09/buckle-up-for-bumpier-skies,277.
Factory Logic,https://asteriskmag.com/issues/13/factory-logic,278.
"The 1,700-year-old megastructure history almost forgot",https://www.cnn.com/2026/02/28/travel/travel-news-jetavanaramaya-ephesus,279.
"Foreign National Gets 20 Yrs for Trafficing Nuclear, Narcotics, and Firearms",https://www.justice.gov/opa/pr/foreign-national-sentenced-20-years-prison-conspiring-traffic-nuclear-materials-narcotics,280.
"Whoops, Websites Realize That Killing Their Comment Sections Was a Mistake",https://www.techdirt.com/2026/02/03/whoops-websites-realize-that-killing-their-comment-sections-was-a-mistake/,281.
Speculative Speculative Decoding (SSD),https://arxiv.org/abs/2603.03251,282.
Ape Coding [fiction],https://rsaksida.com/blog/ape-coding/,283.
Ghostty – Terminal Emulator,https://ghostty.org/docs,284.
Emacs Bedrock,https://codeberg.org/ashton314/emacs-bedrock,285.
Devenv 2.0: A Fresh Interface to Nix,https://devenv.sh/blog/2026/03/05/devenv-20-a-fresh-interface-to-nix/,286.
The largest emergency stockpile of crude oil is quickly falling apart,https://www.spglobal.com/energy/en/news-research/blog/crude-oil/061516-a-rare-tour-of-the-strategic-petroleum-reserve,287.
iPhone 17e,https://www.apple.com/newsroom/2026/03/apple-introduces-iphone-17e/,288.
Computer-generated dream world: Virtual reality for a 286 processor,https://deadlime.hu/en/2026/02/22/computer-generated-dream-world/,289.
Charging a three-cell nickel-based battery pack with a Li-Ion charger [pdf],https://www.ti.com/lit/an/slyt468/slyt468.pdf,290.
The trackball that merges pointing and 3D control,https://rotatrix.com,291.
Man Cereal,https://joshcollinsworth.com/blog/man-cereal,292.
Points on a ring: An interactive walkthrough of a popular math problem,https://growingswe.com/blog/points-on-ring,293.
"""That Shape Had None"" – A Horror of Substrate Independence (Short Fiction)",https://starlightconvenience.net/#that-shape-had-none,294.
Giving LLMs a personality is just good engineering,https://www.seangoedecke.com/giving-llms-a-personality/,295.
"AMD Am386 released March 2, 1991",https://dfarq.homeip.net/amd-am386-released-march-2-1991/,296.
Most-read tech publications have lost over half their Google traffic since 2024,https://growtika.com/blog/tech-media-collapse,297.
130k Lines of Formal Topology: Simple and Cheap Autoformalization for Everyone?,https://arxiv.org/abs/2601.03298,298.
Agentic Engineering Anti Patterns,https://simonwillison.net/guides/agentic-engineering-patterns/anti-patterns/,299.
Show HN: Docker pulls more than it needs to - and how we can fix it,https://dockerpull.com,300.
Show HN: RISCY-V02: A 16-bit 2-cycle RISC-V-ish CPU in the 6502 footprint,https://github.com/mysterymath/riscyv02-sky,301.
Packaging a Gleam app into a single executable (2025),https://www.dhzdhd.dev/blog/gleam-executable,302.
"Inside the M4 Apple Neural Engine, Part 1: Reverse Engineering",https://maderix.substack.com/p/inside-the-m4-apple-neural-engine,303.
LFortran compiles fpm,https://lfortran.org/blog/2026/02/lfortran-compiles-fpm/,304.
India's top court angry after junior judge cites fake AI-generated orders,https://www.bbc.com/news/articles/c178zzw780xo,305.
The coming war on general-purpose computation (2011),https://lwn.net/Articles/473794/,306.
"FCC Chair to Europe: If You Restrict US Satellite Providers, We'll Ban You Here",https://www.pcmag.com/news/fcc-chair-to-europe-restrict-us-satellite-providers-well-ban-you-in-us,307.
Against Query Based Compilers,https://matklad.github.io/2026/02/25/against-query-based-compilers.html,308.
10-202: Introduction to Modern AI (CMU),https://modernaicourse.org,309.
Simplifying Application Architecture with Modular Design and MIM,https://codingfox.net.pl/posts/mim/,310.
Did Alibaba just kneecap its powerful Qwen AI team?,https://venturebeat.com/technology/did-alibaba-just-kneecap-its-powerful-qwen-ai-team-key-figures-depart-in,311.
Don't use passkeys for encrypting user data,https://blog.timcappalli.me/p/passkeys-prf-warning/,312.
You don't have to,https://www.scottsmitelli.com/articles/you-dont-have-to/,313.
AI-generated art can’t be copyrighted after Supreme Court declines review,https://www.theverge.com/policy/887678/supreme-court-ai-art-copyright,314.
I built a demo of what AI chat will look like when it's “free” and ad-supported,https://99helpers.com/tools/ad-supported-chat,315.
OpenAI agrees with Dept. of War to deploy models in their classified network,https://twitter.com/sama/status/2027578652477821175,316.
The Great Online Game (2021),https://www.notboring.co/p/the-great-online-game,317.
OpenWrt 25.12.0 – Stable Release,https://openwrt.org/releases/25.12/notes-25.12.0,318.
Modular: Structured Mojo Kernels,https://www.modular.com/blog/structured-mojo-kernels-part-1-peak-performance-half-the-code,319.
Possible US Government iPhone-Hacking Toolkit in foreign spy and criminal hands,https://www.wired.com/story/coruna-iphone-hacking-toolkit-us-government/,320.
"'Our consciousness is under siege': On chatbots, social media and mental freedom",https://www.theguardian.com/wellness/2026/mar/05/michael-pollan-book-a-world-appears-consciousness-hygiene,321.
Major airline bans 'barebeaters' across all 24 daily flights from UK airports,https://metro.co.uk/2026/03/04/major-airline-bans-barebeaters-across-24-daily-flights-uk-airports-27221151/,322.
Physicists developing a quantum computer that’s entirely open source,https://physics.aps.org/articles/v19/24,323.
Zclaw – The 888 KiB Assistant,https://zclaw.dev,324.
Process-Based Concurrency: Why Beam and OTP Keep Being Right,https://variantsystems.io/blog/beam-otp-process-concurrency,325.
Emacs internals: Deconstructing Lisp_Object in C (Part 2),https://thecloudlet.github.io/blog/project/emacs-02/,326.
'ATM jackpotting' leads FBI to issue warning. Here's what to know,https://www.usatoday.com/story/money/2026/02/27/atm-jackpotting-fbi-warning/88896796007/,327.
The United States and Israel have launched a major attack on Iran,https://www.cnn.com/2026/02/28/middleeast/israel-attack-iran-intl-hnk,328.
"US asked Ukraine for help fighting Iranian drones, Zelensky says",https://www.bbc.com/news/articles/cr5llg0e9g9o,329.
Everett shuts down Flock camera network after judge rules footage public record,https://www.wltx.com/article/news/nation-world/281-53d8693e-77a4-42ad-86e4-3426a30d25ae,330.
GrapheneOS: Microsoft Authenticator does not support secure Android OS,https://www.heise.de/en/news/GrapheneOS-Microsoft-Authenticator-does-not-support-secure-Android-OS-11200495.html,331.
Extending single-minus amplitudes to gravitons,https://openai.com/index/extending-single-minus-amplitudes-to-gravitons/,332.
Lenovo’s new ThinkPads score 10/10 for repairability,https://www.ifixit.com/News/115827/new-thinkpads-score-perfect-10-repairability,333.
Intent-Based Commits,https://github.com/adamveld12/ghost,334.
Jolla phone – a full-stack European alternative,https://commerce.jolla.com/products/jolla-phone-sept-26,335.
Trojan Source: Invisible Vulnerabilities,https://arxiv.org/abs/2111.00169,336.
Decision trees – the unreasonable power of nested decision rules,https://mlu-explain.github.io/decision-tree/,337.
United Airlines can permanently ban passengers who don't wear headphones,https://www.theverge.com/transportation/890202/united-airlines-headphones-policy-contract-of-carriage,338.
Show HN: Effective Git,https://github.com/nolasoft/okgit,339.
Neocaml – Rubocop Creator's New OCaml Mode for Emacs,https://github.com/bbatsov/neocaml,340.
Open Source Iran War Cost Tracker: 45.7B,https://iranwarcost.com,341.
LLM Prose Tells,https://git.eeqj.de/sneak/prompts/src/branch/main/prompts/LLM_PROSE_TELLS.md,342.
Welcome (back) to Macintosh,https://take.surf/2026/03/01/welcome-back-to-macintosh,343.
Mount Mayhem at Netflix: Scaling Containers on Modern CPUs,https://netflixtechblog.com/mount-mayhem-at-netflix-scaling-containers-on-modern-cpus-f3b09b68beac,344.
Show HN: Pianoterm – Run shell commands from your Piano. A Linux CLI tool,https://github.com/vustagc/pianoterm,345.
Unsloth Dynamic 2.0 GGUFs,https://unsloth.ai/docs/basics/unsloth-dynamic-2.0-ggufs,346.
Iran says targeted AWS Data Centers for support of U.S. military,https://www.cnbc.com/2026/03/04/amazon-bahrain-data-centers-targeted-iran-drone-strike.html,347.
We automated everything except knowing what's going on,https://eversole.dev/blog/we-automated-everything/,348.
Sea level much higher than assumed in most coastal hazard assessments,https://www.nature.com/articles/s41586-026-10196-1,349.
Excommunicated devs making games with AI,https://www.tyleo.com/blog/the-excommunicated-devs-making-games-with-ai,350.
Judge finalizes order for Greenpeace to pay $345M in ND oil pipeline case,https://northdakotamonitor.com/2026/02/27/judge-finalizes-order-for-greenpeace-to-pay-345-million-in-north-dakota-oil-pipeline-case/,351.
Anthropic chief back in talks with Pentagon about AI deal,https://www.ft.com/content/97bda2ef-fc06-40b3-a867-f61a711b148b,352.
Moldova broke our data pipeline,https://www.avraam.dev/blog/moldova-broke-our-pipeline,353.
SCOTUS declines to hear dispute over copyrights for AI-generated material,https://www.reuters.com/legal/government/us-supreme-court-declines-hear-dispute-over-copyrights-ai-generated-material-2026-03-02/,354.
Next-gen spacecraft are overwhelming communication networks,https://atempleton.bearblog.dev/how-next-gen-spacecraft-are-overwhelming-our-communication-networks/,355.
An ode to houseplant programming (2025),https://hannahilea.com/blog/houseplant-programming/,356.
"Au Revoir, Eleventy",https://hamatti.org/posts/au-revoir-eleventy/,357.
Show HN: Govbase – Follow a bill from source text to news bias to social posts,https://govbase.com,358.
LLMs can unmask pseudonymous users at scale with surprising accuracy,https://arstechnica.com/security/2026/03/llms-can-unmask-pseudonymous-users-at-scale-with-surprising-accuracy/,359.
SRGB↔XYZ Conversion (2021),https://mina86.com/2019/srgb-xyz-conversion/,360.
White House Uses Call of Duty Footage in Showcase of Destruction in Iran War,https://www.gamespot.com/articles/white-house-uses-call-of-duty-footage-in-showcase-of-destruction-in-iran-war/1100-6538580/,361.
Ask HN: Who is hiring? (March 2026),item?id=47219668,362.
The 185-Microsecond Type Hint,https://blog.sturdystatistics.com/posts/type_hint/,363.
Age Verification: Protection Tool or Surveillance in Disguise?,https://itsfoss.com/news/our-take-on-age-verification/,364.
Anthropic Cowork feature creates 10GB VM bundle on macOS without warning,https://github.com/anthropics/claude-code/issues/22543,365.
19th century silent film that first captured a robot attack,https://www.npr.org/2026/02/28/nx-s1-5730373/georges-melies-robot-film-1897-library-of-congress-gugusse-automate,366.
Robust and efficient quantum-safe HTTPS,https://security.googleblog.com/2026/02/cultivating-robust-and-efficient.html,367.
Language Model Contains Personality Subnetworks,https://arxiv.org/abs/2602.07164,368.
Little Free Library,https://littlefreelibrary.org/,369.
A Temporal Dark Patterns Audit of McDonald's Self-Ordering Kiosk Flow,https://arxiv.org/abs/2603.03218,370.
Verified Spec-Driven Development (VSDD),https://gist.github.com/dollspace-gay/d8d3bc3ecf4188df049d7a4726bb2a00,371.
Build your own Command Line with ANSI escape codes (2016),https://www.lihaoyi.com/post/BuildyourownCommandLinewithANSIescapecodes.html,372.
Obsidian Sync now has a headless client,https://help.obsidian.md/sync/headless,373.
Mullvad VPN: Banned TV Ad in the Streets of London [video],https://www.youtube.com/watch?v=rwhznrpgl7k,374.
OpenAI Symphony,https://github.com/openai/symphony,375.
Congress Is Considering Abolishing Your Right to Be Anonymous Online,https://theintercept.com/2026/03/05/kosa-online-age-verification-free-speech-privacy/,376.
What’s in a name? (2014),https://sailsandcommas.com/2014/02/03/whats-in-a-name/,377.
We gave terabytes of CI logs to an LLM,https://www.mendral.com/blog/llms-are-good-at-sql,378.
FBI Nabs Contractor for Allegedly Stealing Crypto from Marshals,https://www.bloomberg.com/news/articles/2026-03-05/fbi-arrests-contractor-in-alleged-crypto-theft-held-by-marshals,379.
Show HN: uBlock filter list to blur all Instagram Reels,https://gist.github.com/shraiwi/009c652da6ce8c99a6e1e0c86fe66886,380.
WebMCP is available for early preview,https://developer.chrome.com/blog/webmcp-epp,381.
Rust zero-cost abstractions vs. SIMD,https://turbopuffer.com/blog/zero-cost,382.
We Will Not Be Divided,https://notdivided.org,383.
Two kinds of error,https://evanhahn.com/the-two-kinds-of-error/,384.
"Iran war wreaking havoc on shipping and air cargo, could create global delays",https://www.theregister.com/2026/03/02/iran_war_tech_supply_chain/,385.
747s and coding agents,https://carlkolon.com/2026/02/27/engineering-747-coding-agents/,386.
Plugtest,https://en.wikipedia.org/wiki/Plugtest,387.
Show HN: Paste a URL and watch multiple AI models redesign it side-by-side,https://shuffle.dev/ai-website-redesign,388.
Show HN: Web Audio Studio – A Visual Debugger for Web Audio API Graphs,https://webaudio.studio/,389.
Remote Firmware Injection in Popular Solar Inverters,https://jakkaru.de/articles/apsystems-remote-firmware-injection,390.
Why a Robotics Startup's Failure Proves the Robot Starts with the Actuator,https://www.firgelli.com/blogs/news/k-scale-labs-failure-proves-robot-starts-with-actuator,391.
Enable CORS for Your Blog,https://www.blogsareback.com/guides/enable-cors,392.
Large-Scale Agentic RL for CUDA Kernel Generation,https://cuda-agent.github.io/,393.
Elevated Errors in Claude.ai,https://status.claude.com/incidents/yf48hzysrvl5,394.
Amazon Appears to Be Down,https://arstechnica.com/gadgets/2026/03/amazon-appears-to-be-down-with-over-20000-reported-problems/,395.
Show HN: I put HN discussions next to the article where it belongs,https://cool-link-web-production.up.railway.app/l/blogabout,396.
A Chinese official’s use of ChatGPT revealed an intimidation operation,https://www.cnn.com/2026/02/25/politics/chatgpt-china-intimidation-operation,397.
The Future of AI,https://lucijagregov.com/2026/02/26/the-future-of-ai/,398.
"Sam Altman Wants Elected Officials, Not OpenAI, to Decide How Military Uses AI",https://www.wsj.com/tech/ai/sam-altman-wants-elected-officials-not-openai-to-decide-how-military-uses-ai-458910cd,399.
The whole thing was a scam,https://garymarcus.substack.com/p/the-whole-thing-was-scam,400.
The ping-verse: a deep dive into 14 ping-type utilities across OSI layers,https://netbeez.net/blog/a-guide-to-every-ping-utility/,401.
ChatGPT 5.4 Pro: A simple 'Hi' cost me $80,https://xcancel.com/Yuchenj_UW/status/2029645361548251271?s=20,402.
"Show HN: Qlog – grep for logs, but 100x faster",https://github.com/Cosm00/qlog,403.
Bootc and OSTree: Modernizing Linux System Deployment,https://a-cup-of.coffee/blog/ostree-bootc/,404.
Notes on Lagrange Interpolating Polynomials,https://eli.thegreenplace.net/2026/notes-on-lagrange-interpolating-polynomials/,405.
Croatia declared free of landmines after 31 years,https://glashrvatske.hrt.hr/en/domestic/croatia-declared-free-of-landmines-after-31-years-12593533,406.
Microsoft Is Stress-Testing the Agentic AI Bubble in Its Own Gaming Division,https://softcurrency.substack.com/p/microsoft-is-stress-testing-the-agentic,407.
Show HN: Open-Source Article 12 Logging Infrastructure for the EU AI Act,item?id=47230438,408.
"Amazon Lightsail now offers OpenClaw, a private self-hosted AI assistant",https://aws.amazon.com/about-aws/whats-new/2026/03/amazon-lightsail-openclaw/,409.
Palantir's Double Conflict of Interest in the War Against Iran,https://bylinetimes.com/2026/03/05/palantirs-double-conflict-of-interest-in-the-war-against-iran/,410.
Claude becomes number one app on the U.S. App Store,https://apps.apple.com/us/iphone/charts,411.
Show HN: A GFM+GF-MathJax/Latex HTML formatting adventure,https://github.com/scottvr/phart/blob/main/docs/GHM-LATEX.md,412.
An Interesting Find: STM32 RDP1 Decryptor,https://carlossless.io/stm32-rdp1-decryptor/,413.
The Case for Apolitical Tech Spaces,https://minor.gripe/posts/2026-03-02-the_case_for_apolitical_tech_spaces/,414.
Rising carbon dioxide levels now detected in human blood,https://phys.org/news/2026-02-carbon-dioxide-human-blood.html,415.
Qt45: A small polymerase ribozyme that can synthesize itself,https://www.science.org/doi/10.1126/science.adt2760,416.
A case for Go as the best language for AI agents,https://getbruin.com/blog/go-is-the-best-language-for-agents/,417.
Our Agreement with the Department of War,https://openai.com/index/our-agreement-with-the-department-of-war,418.
A plastic made from milk that vanishes in 13 weeks,https://www.sciencedaily.com/releases/2026/02/260227071922.htm,419.
1.5 Million Users Leave ChatGPT,https://www.forbes.com/sites/barrycollins/2026/03/02/leaving-chatgpt-make-sure-to-do-this-before-you-cancel/,420.
Court finds Fourth Amendment doesn’t support broad search of protesters’ devices,https://www.eff.org/deeplinks/2026/02/victory-tenth-circuit-finds-fourth-amendment-doesnt-support-broad-search-0,421.
The Windows 95 user interface: A case study in usability engineering (1996),https://dl.acm.org/doi/fullHtml/10.1145/238386.238611,422.
Flightradar24 for Ships,https://atlas.flexport.com/,423.
DOJ proposes policy aimed at limiting state bar ethics probes into its attorneys,https://abcnews.com/US/doj-proposes-policy-aimed-limiting-state-bar-ethics/story?id=130755238,424.
Switch to Claude without starting over,https://claude.com/import-memory,425.
Rust is just a tool,https://lewiscampbell.tech/blog/260204.html,426.
Why is the first C++ (m)allocation always 72 KB?,https://joelsiks.com/posts/cpp-emergency-pool-72kb-allocation/,427.
Chaos and Dystopian news for the dead internet survivors,https://www.fubardaily.com,428.
Iranian strikes on Amazon data centers highlight industry's vulnerability,https://apnews.com/article/amazon-aws-data-center-uae-iran-bahrain-71066b0a822c4cfd88b61e3fe79af917,429.
Allocating on the Stack,https://go.dev/blog/allocation-optimizations,430.
Proton Mail Helped FBI Unmask Anonymous 'Stop Cop City' Protester,https://www.404media.co/proton-mail-helped-fbi-unmask-anonymous-stop-cop-city-protestor/,431.
Six Things I Learned Watching a Robotics Startup Die from the Inside,https://ruixu.us/posts/six-things-robotics-startup,432.
New iron nanomaterial wipes out cancer cells without harming healthy tissue,https://www.sciencedaily.com/releases/2026/02/260228093456.htm,433.
Drizzle Joins PlanetScale,https://planetscale.com/blog/drizzle-joins-planetscale,434.
"Time, Space, and Life as We Know It (2017)",https://raganwald.com/2017/01/12/time-space-life-as-we-know-it.html,435.
Statement on the comments from Secretary of War Pete Hegseth,https://www.anthropic.com/news/statement-comments-secretary-war,436.
"Iran's Ayatollah Ali Khamenei is killed in Israeli strike, ending 36-year rule",https://www.npr.org/2026/02/28/1123499337/iran-israel-ayatollah-ali-khamenei-killed,437.
Ask HN: Has anyone noticed the fear-driven prompt suggestions that GPT5.3 makes?,item?id=47256208,438.
Invite people over to your home regularly,https://blog.mattglassman.net/you-should-invite-people-over-to-your-home-regularly/,439.
