Title,Link,Rank
LibreSprite – open-source pixel art editor,https://libresprite.github.io/,1.
System76 on Age Verification Laws,https://blog.system76.com/post/system76-on-age-verification/,2.
GPL upgrades via section 14 proxy delegation,https://runxiyu.org/comp/gplproxy/,3.
GPT-5.4,https://openai.com/index/introducing-gpt-5-4/,4.
Hardening Firefox with Anthropic's Red Team,https://blog.mozilla.org/en/firefox/hardening-firefox-anthropic-red-team/,5.
Async Programming Is Just Inject Time,https://willhbr.net/2026/03/02/async-inject-and-effects/,6.
10% of Firefox crashes are caused by bitflips,https://mas.to/@gabrielesvelto/116171750653898304,7.
Show HN: Swarm – Program a colony of 200 ants using a custom assembly language,https://dev.moment.com/,8.
Elite Overproduction,https://en.wikipedia.org/wiki/Elite_overproduction,9.
A GitHub Issue Title Compromised 4k Developer Machines,https://grith.ai/blog/clinejection-when-your-ai-tool-installs-another,10.
Payphone Go,https://walzr.com/payphone-go/,11.
The Brand Age,https://paulgraham.com/brandage.html,12.
Labor market impacts of AI: A new measure and early evidence,https://www.anthropic.com/research/labor-market-impacts,13.
Good software knows when to stop,https://ogirardot.writizzy.com/p/good-software-knows-when-to-stop,14.
Where things stand with the Department of War,https://www.anthropic.com/news/where-stand-department-war,15.
"A standard protocol to handle and discard low-effort, AI-Generated pull requests",https://406.fail/,16.
Stardex (YC S21) is hiring customer success engineers,https://www.ycombinator.com/companies/stardex/jobs/lag1C1P-customer-success-engineer-ai-data-migration,17.
Stupidly Obscure Programming in a Troubled Time (2018),https://blog.podsnap.com/apply.html,18.
Wikipedia was in read-only mode following mass admin account compromise,https://www.wikimediastatus.net,19.
First MacBook Neo Benchmarks Are In,https://www.macrumors.com/2026/03/05/macbook-neo-first-benchmarks/,20.
CBP tapped into the online advertising ecosystem to track peoples’ movements,https://www.404media.co/cbp-tapped-into-the-online-advertising-ecosystem-to-track-peoples-movements/,21.
Image manipulation with convolution using Julia,https://medium.com/@Ahmad_Hamze/image-manipulation-with-convolution-using-julia-f898995ac1e5,22.
AI and the Ship of Theseus,https://lucumr.pocoo.org/2026/3/5/theseus/,23.
A ternary plot of citrus geneology,https://www.jlauf.com/writing/citrus/,24.
"Hardware hotplug events on Linux, the gory details",https://arcanenibble.github.io/hardware-hotplug-events-on-linux-the-gory-details.html,25.
Remotely unlocking an encrypted hard disk,https://jyn.dev/remotely-unlocking-an-encrypted-hard-disk/,26.
Judge orders government to begin refunding more than $130B in tariffs,https://www.wsj.com/politics/policy/judge-orders-government-to-begin-refunding-more-than-130-billion-in-tariffs-fdc1e62c,27.
Screeching Sound of Peeling Tape,https://journals.aps.org/pre/abstract/10.1103/p19h-9ysx,28.
"Show HN: PageAgent, A GUI agent that lives inside your web app",https://alibaba.github.io/page-agent/,29.
How to install and start using LineageOS on your phone,https://lockywolf.net/2026-02-19_How-to-install-and-start-using-LineageOS-on-your-phone.d/index.html,30.
"Show HN: Jido 2.0, Elixir Agent Framework",https://jido.run/blog/jido-2-0-is-here,31.
Launch HN: Vela (YC W26) – AI for complex scheduling,item?id=47264741,32.
"Show HN: Tensor Spy: inspect NumPy and PyTorch tensors in the browser, no upload",https://tensorspy.com/,33.
Data does not speak to you,https://tantaman.com/2026-03-02-data-doesnt-speak.html,34.
The home computer war,https://technicshistory.com/2026/03/06/the-home-computer-war/,35.
Hacking Super Mario 64 using covering spaces,https://happel.ai/posts/covering-spaces-geometries-visualized/,36.
TeX Live 2026 is available for download now,https://www.tug.org/texlive/acquire.html,37.
OpenTitan Shipping in Production,https://opensource.googleblog.com/2026/03/opentitan-shipping-in-production.html,38.
Every Claim from Meta Child Safety Trials,https://meta-trials.vercel.app/,39.
Nobody ever got fired for using a struct,https://www.feldera.com/blog/nobody-ever-got-fired-for-using-a-struct,40.
Poor Man's Polaroid,https://boxart.lt/blog/poor_mans_polaroid?locale=en,41.
The Illusion of Building,https://uphack.io/blog/post/the-illusion-of-building/,42.
Converting dash cam videos into Panoramax images,https://www.openstreetmap.org/user/FeetAndInches/diary/408268,43.
Optimizing Recommendation Systems with JDK's Vector API,https://netflixtechblog.com/optimizing-recommendation-systems-with-jdks-vector-api-30d2830401ec,44.
Greg Kroah-Hartman Stretches Support Periods for Key Linux LTS Kernels,https://fossforce.com/2026/03/greg-kroah-hartman-stretches-support-periods-for-key-linux-lts-kernels/,45.
MacBook Neo,https://www.apple.com/newsroom/2026/03/say-hello-to-macbook-neo/,46.
Let's Get Physical,https://m4iler.cloud/posts/lets-get-physical/,47.
Proton Mail Helped FBI Unmask Anonymous 'Stop Cop City' Protester,https://www.404media.co/proton-mail-helped-fbi-unmask-anonymous-stop-cop-city-protestor/,48.
Datasets for Reconstructing Visual Perception from Brain Data,https://github.com/seelikat/neuro-visual-reconstruction-dataset-index,49.
Shut Up and Take My Money,https://lorendb.dev/posts/shut-up-and-take-my-money/,50.
Cameras built to police Iranians became the regime's Achilles' heel,https://royapakzad.substack.com/p/youre-welcome-mr-supreme-leader,51.
A man who broke into jail,https://www.newyorker.com/magazine/2026/03/09/alexander-friedmann-profile-prison-reform,52.
"Parsync, a tool for parallel SSH transfers – 7x faster than rsync",https://github.com/AlpinDale/parsync,53.
Google Workspace CLI,https://github.com/googleworkspace/cli,54.
Typst Examples Book,https://sitandr.github.io/typst-examples-book/book/,55.
"Weight-loss jab could be made for $3 a month, study finds",https://www.theguardian.com/global-development/2026/mar/06/generic-drugs-weight-loss-semaglutide-ozempic-wegovy-diabetes-obesity-study,56.
GLiNER2: Unified Schema-Based Information Extraction,https://github.com/fastino-ai/GLiNER2,57.
"Smalltalk's Browser: Unbeatable, yet Not Enough",https://blog.lorenzano.eu/smalltalks-browser-unbeatable-yet-not-enough/,58.
Jails for NetBSD – Kernel Enforced Isolation and Native Resource Control,https://netbsd-jails.petermann-digital.de/,59.
"The next generations of Bubble Tea, Lip Gloss, and Bubbles are available now",https://charm.land/blog/v2/,60.
Arabic document from 17th-cent. rubbish heap confirms semi-legendary Nubian king,https://phys.org/news/2026-02-arabic-document-17th-century-rubbish.html,61.
Fast-Servers,https://geocar.sdf1.org/fast-servers.html,62.
"Mozilla is working on a big Firefox redesign, here is what it looks like",https://www.neowin.net/news/mozilla-is-working-on-a-big-firefox-redesign-here-is-what-it-looks-like/,63.
Claude's Cycles [pdf],https://www-cs-faculty.stanford.edu/~knuth/papers/claude-cycles.pdf,64.
Nvidia PersonaPlex 7B on Apple Silicon: Full-Duplex Speech-to-Speech in Swift,https://blog.ivan.digital/nvidia-personaplex-7b-on-apple-silicon-full-duplex-speech-to-speech-in-native-swift-with-mlx-0aa5276f2e23,65.
Partnering with Mozilla to improve Firefox's security,https://www.anthropic.com/news/mozilla-firefox-security,66.
Dulce et Decorum Est (1921),https://www.poetryfoundation.org/poems/46560/dulce-et-decorum-est,67.
US tech firms pledge at White House to bear costs of energy for datacenters,https://www.theguardian.com/us-news/2026/mar/04/us-tech-companies-energy-cost-pledge-white-house,68.
"How to Found a Company in Germany: 16 ""Easy"" Steps and Lots of Pain",https://eidel.io/posts/how-to-found-a-company-in-germany-14-easy-steps-and-lots-of-pain,69.
Fixpoints to think clearly,https://blog.yellowflash.in/posts/2026-03-03-fixpoints-for-clarity.html,70.
The remaking of Thomas Mann,https://www.commonwealmagazine.org/thomas-mann-magic-mountain-jensen,71.
Breaking Down 50M Pins: A Smarter Way to Design 3D IC Packages,https://www.allaboutcircuits.com/industry-articles/breaking-down-50-million-pins-a-smarter-way-to-design-3d-ic-packages/,72.
"The L in ""LLM"" Stands for Lying",https://acko.net/blog/the-l-in-llm-stands-for-lying/,73.
Seventeen Years of Coding and Starting Over,https://www.sunilshenoy.com/2026/03/05/seventeen-years-of-coding-and.html,74.
OpenBSD on SGI: A Rollercoaster Story,http://miod.online.fr/software/openbsd/stories/sgiall.html,75.
Motorola GrapheneOS devices will be bootloader unlockable/relockable,https://grapheneos.social/@GrapheneOS/116160393783585567,76.
"Electrobun and WGPU: Tiny, cross-platform games and ML with Bun",https://blackboard.sh/blog/wgpu-in-electrobun/,77.
Relicensing with AI-Assisted Rewrite,https://tuananh.net/2026/03/05/relicensing-with-ai-assisted-rewrite/,78.
OpenWrt 25.12 Stable Release,https://forum.openwrt.org/t/openwrt-25-12-0-stable-release/247228,79.
Building a new Flash,https://bill.newgrounds.com/news/post/1607118,80.
"Billy bookshelves as a retro motherboard ""rack""",https://rubenerd.com/billy-bookcase-as-a-retro-motherboard-rack/,81.
World-first gigabit laser link between aircraft and geostationary satellite,https://www.esa.int/Applications/Connectivity_and_Secure_Communications/World-first_gigabit-per-second_laser_link_between_aircraft_and_geostationary_satellite,82.
Show HN: Moji â€“ A read-it-later app with self-organizing smart collections,https://moji.pcding.com,83.
Enhanced brain cells clear away dementia-related proteins,https://medicalxpress.com/news/2026-03-brain-cells-dementia-proteins.html,84.
"The Self-Help Trap: What 20 Years of ""Optimizing"" Has Taught Me",https://tim.blog/2026/03/04/the-self-help-trap/,85.
MyFirst Kids Watch Hacked. Access to Camera and Microphone,https://www.kth.se/en/om/nyheter/centrala-nyheter/kth-studenten-hackade-klocka-for-barn-1.1461249,86.
Earth Garden: Field Recordings Around the World,https://earth-garden.alen.ro/,87.
A CPU that runs entirely on GPU,https://github.com/robertcprice/nCPU,88.
Glaze by Raycast,https://www.glazeapp.com/,89.
Something is afoot in the land of Qwen,https://simonwillison.net/2026/Mar/4/qwen/,90.
Raspberry Pi Pico as AM Radio Transmitter,https://www.pesfandiar.com/blog/2026/02/28/pico-am-radio-transmitter,91.
We might all be AI engineers now,https://yasint.dev/we-might-all-be-ai-engineers-now/,92.
No right to relicense this project,https://github.com/chardet/chardet/issues/327,93.
Google Safe Browsing missed 84% of confirmed phishing sites,https://www.norn-labs.com/blog/huginn-report-feb-2026,94.
Was Windows 1.0's lack of overlapping windows a legal or a technical matter?,https://retrocomputing.stackexchange.com/questions/32511/was-windows-1-0s-lack-of-overlapping-windows-a-legal-or-a-technical-matter,95.
AMD will bring its “Ryzen AI” processors to standard desktop PCs for first time,https://arstechnica.com/gadgets/2026/03/amd-ryzen-ai-400-cpus-will-bring-upgraded-graphics-to-socket-am5-desktops/,96.
Remembering mayhem,https://blog.metabrainz.org/2026/03/05/remembering-mayhem/,97.
Emails to Outlook.com rejected due to a fault or overzealous blocking rules,https://www.theregister.com/2026/03/04/users_fume_at_outlookcom_email/,98.
Show HN: Kanon 2 Enricher – the first hierarchical graphitization model,https://isaacus.com/blog/kanon-2-enricher,99.
Show HN: Poppy – A simple app to stay intentional with relationships,https://poppy-connection-keeper.netlify.app/,100.
The View from RSS,https://www.carolinecrampton.com/the-view-from-rss/,101.
RE#: how we built the fastest regex engine in F#,https://iev.ee/blog/resharp-how-we-built-the-fastest-regex-in-fsharp/,102.
Code World Models for Parameter Control in Evolutionary Algorithms,https://www.alphaxiv.org/abs/2602.22260,103.
A rabbit hole in 5 commits,https://www.codingwithjesse.com/blog/a-rabbit-hole-in-5-commits/,104.
"To understand our fascination with crystals, researchers gave some to chimps",https://www.nytimes.com/2026/03/04/science/chimpanzees-crystals.html,105.
Show HN: Hormuz Crisis Dashboard Real-time shipping disruption tracker,https://www.hormuztracker.com/,106.
An interactive map of Flock Cams,https://deflock.org/map#map=5/37.125286/-96.284180,107.
Data has weight but only on SSDs,https://cubiclenate.com/2026/03/04/data-has-weight-but-only-on-ssds-blathering/,108.
You Just Reveived,https://dylan.gr/1772520728,109.
Motorola announces a partnership with GrapheneOS,https://motorolanews.com/motorola-three-new-b2b-solutions-at-mwc-2026/,110.
Meta’s AI smart glasses and data privacy concerns,https://www.svd.se/a/K8nrV4/metas-ai-smart-glasses-and-data-privacy-concerns-workers-say-we-see-everything,111.
BMW Group to deploy humanoid robots in production in Germany for the first time,https://www.press.bmwgroup.com/global/article/detail/T0455864EN/bmw-group-to-deploy-humanoid-robots-in-production-in-germany-for-the-first-time?language=en,112.
Qwen3.5 Fine-Tuning Guide,https://unsloth.ai/docs/models/qwen3.5/fine-tune,113.
"Show HN: SitDeck – Customizable live dashboard of news, markets, threats",https://sitdeck.com,114.
British Columbia is permanently adopting daylight time,https://www.cbc.ca/news/canada/british-columbia/b-c-adopting-year-round-daylight-time-9.7111657,115.
Weave – A language aware merge algorithm based on entities,https://github.com/Ataraxy-Labs/weave,116.
What Python’s asyncio primitives get wrong about shared state,https://www.inngest.com/blog/no-lost-updates-python-asyncio,117.
Graphics Programming Resources,https://develop--gpvm-website.netlify.app/resources/,118.
Show HN: Stacked Game of Life,https://stacked-game-of-life.koenvangilst.nl/,119.
Ask HN: How many of you hold an amateur radio license in your country?,item?id=47232091,120.
Firefox Nova – our first look at the browser's big redesign,https://www.omgubuntu.co.uk/2026/03/firefox-nova-redesign,121.
My spicy take on vibe coding for PMs,https://www.ddmckinnon.com/2026/02/11/my-%f0%9f%8c%b6-take-on-vibe-coding-for-pms/,122.
"TikTok will not introduce end-to-end encryption, saying it makes users less safe",https://www.bbc.com/news/articles/cly2m5e5ke4o,123.
Launch HN: Cekura (YC F24) – Testing and monitoring for voice and chat AI agents,item?id=47232903,124.
MacBook Pro with M5 Pro and M5 Max,https://www.apple.com/newsroom/2026/03/apple-introduces-macbook-pro-with-all-new-m5-pro-and-m5-max/,125.
Intelligence is a commodity. Context is the real AI Moat,https://adlrocha.substack.com/p/adlrocha-intelligence-is-a-commodity,126.
An effort to secure the Network Time Protocol,https://lwn.net/Articles/1059200/,127.
Making Firefox's right-click not suck with about:config,https://joshua.hu/firefox-making-right-click-not-suck,128.
Stop using grey text (2025),https://catskull.net/stop-using-grey-text.html,129.
"Can coding agents relicense open source through a ""clean room"" implementation?",https://simonwillison.net/2026/Mar/5/chardet/,130.
“It turns out” (2010),https://jsomers.net/blog/it-turns-out,131.
Agentic Engineering Patterns,https://simonwillison.net/guides/agentic-engineering-patterns/,132.
Moss is a pixel canvas where every brush is a tiny program,https://www.moss.town/,133.
Picking Up a Zillion Pieces of Litter,https://www.sixstepstobetterhealth.com/litter.html,134.
Libre Solar – Open Hardware for Renewable Energy,https://libre.solar,135.
Daemon (2006),https://en.wikipedia.org/wiki/Daemon_(novel),136.
Malm Whale,https://www.atlasobscura.com/places/malm-whale,137.
Zed new terms required to be 18 years old,https://zed.dev/terms,138.
The IRIX 6.5.7M (sgi) source code,https://github.com/calmsacibis995/irix-657m-src,139.
"Female astronauts face clotting risks, five-day weightlessness simulation sugges",https://phys.org/news/2026-03-female-astronauts-clotting-day-weightlessness.html,140.
Ninth Circuit Allows TOS Amendment by Email–Ireland-Gordy v. Tile,https://blog.ericgoldman.org/archives/2026/03/ninth-circuit-allows-tos-amendment-by-email-ireland-gordy-v-tile.htm,141.
Faster C software with Dynamic Feature Detection,https://gist.github.com/jjl/d998164191af59a594500687a679b98d,142.
GZOO Cortex – local-first knowledge graph that watches your project files,https://github.com/gzoonet/cortex,143.
Modernizing swapping: virtual swap spaces,https://lwn.net/Articles/1059201/,144.
Dario Amodei calls OpenAI’s messaging around military deal ‘straight up lies’,https://techcrunch.com/2026/03/04/anthropic-ceo-dario-amodei-calls-openais-messaging-around-military-deal-straight-up-lies-report-says/,145.
"The growth of command line options, 1979-Present",https://danluu.com/cli-complexity/,146.
Ethiopia gets $350M World Bank financing for its digital ID project (2024),https://www.mariblock.com/stories/ethiopia-to-get-350-million-world-bank-financing-for-its-digital-id-project,147.
NRC issues first commercial reactor construction approval in 10 years [pdf],https://www.nrc.gov/sites/default/files/cdn/doc-collection-news/2026/26-028.pdf,148.
GPT‑5.3 Instant,https://openai.com/index/gpt-5-3-instant/,149.
Jensen Huang says Nvidia is pulling back from OpenAI and Anthropic,https://techcrunch.com/2026/03/04/jensen-huang-says-nvidia-is-pulling-back-from-openai-and-anthropic-but-his-explanation-raises-more-questions-than-it-answers/,150.
"Crush, Welcome Home",https://charm.land/blog/crush-comes-home/,151.
"NanoGPT Slowrun: Language Modeling with Limited Data, Infinite Compute",https://qlabs.sh/slowrun,152.
Relax NG is a schema language for XML (2014),https://relaxng.org/,153.
The nightmare war scenario is becoming reality in energy markets,https://www.economist.com/finance-and-economics/2026/03/03/the-nightmare-war-scenario-is-becoming-reality-in-energy-markets,154.
BBC Journalist SEO-Hacks ChatGPT and Google's AI,https://www.bbc.com/future/article/20260218-i-hacked-chatgpt-and-googles-ai-and-it-only-took-20-minutes,155.
Ask HN: How are you using multi-agent AI systems in your daily workflow?,item?id=47270020,156.
Dcsctp: An SCTP Implementation for WebRTC Data Channels in Rust,https://github.com/webrtc/dcsctp,157.
A bit of fluid mechanics from scratch not from scratch,https://tsvibt.blogspot.com/2026/02/a-bit-of-fluid-mechanics-from-scratch.html,158.
Humans 40k yrs ago developed a system of conventional signs,https://www.pnas.org/doi/10.1073/pnas.2520385123,159.
California's Problematic Attempt to Add Age-Verification to Software,https://hackaday.com/2026/03/05/californias-problematic-attempt-to-add-age-verification-to-software/,160.
Dbslice: Extract a slice of your production database to reproduce bugs,https://github.com/nabroleonx/dbslice,161.
How Much Money Jeff Bezos Made Since You Started Reading This Page,https://bezoscalculator.com/,162.
Espflash – Go CLI/library for flashing ESP8266/ESP32 with no dependencies,https://github.com/tinygo-org/espflash,163.
Government grant-funded research should not be published in for-profit journals,https://www.experimental-history.com/p/the-one-science-reform-we-can-all,164.
Dasalinization Plants as Military Targets,https://theconversation.com/persian-gulf-desalination-plants-could-become-military-targets-in-regional-war-277597,165.
My Favorite 39C3 Talks,https://asindu.xyz/my-favorite-39c3-talks/,166.
Launch HN: OctaPulse (YC W26) – Robotics and computer vision for fish farming,item?id=47220320,167.
RFC 9849. TLS Encrypted Client Hello,https://www.rfc-editor.org/rfc/rfc9849.html,168.
Modern Illustration: Archive of illustration from c.1950-1975,https://www.modernillustration.org,169.
TorchLean: Formalizing Neural Networks in Lean,https://leandojo.org/torchlean.html,170.
A Visual Guide to DNA Sequencing,https://www.asimov.press/p/dna-sequencing,171.
Ars Technica fires reporter after AI controversy involving fabricated quotes,https://futurism.com/artificial-intelligence/ars-technica-fires-reporter-ai-quotes,172.
The FCC Wants Your Next Customer Service Agent to Be in the U.S.,https://www.wsj.com/business/telecom/the-fcc-wants-your-next-customer-service-agent-to-be-in-the-u-s-3c44e14e,173.
Comparing Python packages for A/B test analysis (with code examples),https://e10v.me/python-packages-for-ab-test-analysis/,174.
Elevator Saga: The elevator programming game (2015),https://play.elevatorsaga.com/index.html,175.
“Microslop” filtered in the official Microsoft Copilot Discord server,https://www.windowslatest.com/2026/03/02/microsoft-gets-tired-of-microslop-bans-the-word-on-its-discord-then-locks-the-server-after-backlash/,176.
Show HN: Rust compiler in PHP emitting x86-64 executables,https://github.com/mrconter1/rustc-php,177.
Physics Girl: Super-Kamiokande – Imaging the sun by detecting neutrinos [video],https://www.youtube.com/watch?v=B3m3AMRlYfc,178.
10–97% in nine minutes: BYD presents second generation of Blade Battery,https://www.electrive.com/2026/03/05/10-97-in-nine-minutes-byd-presents-second-generation-of-blade-battery/,179.
Flip Distance of Convex Triangulations and Tree Rotation Is NP-Complete,https://arxiv.org/abs/2602.22874,180.
Terminal Graphics Protocol,https://sw.kovidgoyal.net/kitty/graphics-protocol/,181.
The Rust calling convention we deserve (2024),https://mcyoung.xyz/2024/04/17/calling-convention/,182.
Show HN: Kybernis – Prevent AI agents from executing the same action twice,https://kybernis.io,183.
A Number with a Shadow,https://campedersen.com/tang,184.
Microgpt,http://karpathy.github.io/2026/02/12/microgpt/,185.
Mac Studio 512GB RAM Option Disappears Amid Global DRAM Shortage,https://www.macrumors.com/2026/03/05/mac-studio-no-512gb-ram-upgrade/,186.
I'm losing the SEO battle for my own open source project,https://twitter.com/Gavriel_Cohen/status/2028821432759717930,187.
Pentagon formally labels Anthropic supply-chain risk,https://www.wsj.com/politics/national-security/pentagon-formally-labels-anthropic-supply-chain-risk-escalating-conflict-ebdf0523,188.
Sem – Semantic Diff behind the new viral merge algo Weave,https://github.com/Ataraxy-Labs/sem,189.
We Built a Video Rendering Engine by Lying to the Browser About What Time It Is,https://blog.replit.com/browsers-dont-want-to-be-cameras,190.
Show HN: Vertex.js – A 1kloc SPA Framework,https://lukeb42.github.io/vertex-manual.html,191.
We've freed Cookie's Bustle from copyright hell,https://gamehistory.org/cookies-bustle/,192.
Stop the Interviews,https://blog.joeschrag.com/2026/03/stop-interviews.html,193.
NY bill to require devices to conduct commercially reasonable age assurance,https://github.com/flatpak/xdg-desktop-portal/pull/1922,194.
On the Design of Programming Languages (1974) [pdf],https://web.cs.ucdavis.edu/~su/teaching/ecs240-w17/readings/PLHistoryGoodDesign.PDF,195.
"Judges to AG: It's OK for the Gov't to Dox People, but Not the Other Way Around?",https://www.techdirt.com/2026/03/05/judges-to-ag-pam-bondi-its-ok-for-the-govt-to-dox-people-but-not-ok-for-people-to-dox-govt-employees/,196.
Indefinite Book Club Hiatus,https://whatever.scalzi.com/2026/03/03/indefinite-book-club-hiatus/,197.
I'm reluctant to verify my identity or age for any online services,https://neilzone.co.uk/2026/03/im-struggling-to-think-of-any-online-services-for-which-id-be-willing-to-verify-my-identity-or-age/,198.
The beauty and terror of modding Windows,https://windowsread.me/p/windhawk-explained,199.
MacBook Air with M5,https://www.apple.com/newsroom/2026/03/apple-introduces-the-new-macbook-air-with-m5/,200.
Parallel coding agents with tmux and Markdown specs,https://schipper.ai/posts/parallel-coding-agents/,201.
AWS outage due to drone attacks in UAE,https://www.bbc.com/news/articles/cgk28nj0lrjo,202.
Show HN: I made a zero-copy coroutine tracer to find my scheduler's lost wakeups,https://github.com/lixiasky-back/coroTracer,203.
You can use newline characters in URLs,https://lemire.me/blog/2026/02/28/you-can-use-newline-characters-in-urls/,204.
"Right-sizes LLM models to your system's RAM, CPU, and GPU",https://github.com/AlexsJones/llmfit,205.
"The Xkcd thing, now interactive",https://editor.p5js.org/isohedral/full/vJa5RiZWs,206.
Disable Your SSH access accidentally with scp,https://sny.sh/hypha/blog/scp,207.
You need to rewrite your CLI for AI agents,https://justin.poehnelt.com/posts/rewrite-your-cli-for-ai-agents/,208.
A Technology for a Low-Trust Society,https://www.theatlantic.com/technology/2026/03/central-lie-prediction-markets/686250/,209.
Ask HN: Who wants to be hired? (March 2026),item?id=47219667,210.
Voxile: A ray-traced game made in its own engine and programming language,https://elbowgreasegames.substack.com/p/voxray-games-pushes-major-update,211.
I built a pint-sized Macintosh,https://www.jeffgeerling.com/blog/2026/pint-sized-macintosh-pico-micro-mac/,212.
Better JIT for Postgres,https://github.com/vladich/pg_jitter,213.
Claude Code told me what tools it needs to work faster,https://sderosiaux.substack.com/p/claude-code-told-me-what-tools-it,214.
"When AI writes the software, who verifies it?",https://leodemoura.github.io/blog/2026/02/28/when-ai-writes-the-worlds-software.html,215.
$800 Monthly Car Payments Are Hurting Car Sales,https://www.nytimes.com/2026/03/05/business/new-car-sales-payments-affordability.html,216.
Daily Driving GrapheneOS,https://blog.matthewbrunelle.com/8-4-months-of-daily-driving-grapheneos/,217.
Ageless Linux: A Debian-based distro that is illegal to distribute in California,https://goblincorps.com/ageless-linux.html,218.
Approximation Game,https://lcamtuf.substack.com/p/approximation-game,219.
Ask HN: Do You Enjoy Your Career in Tech Nowadays?,item?id=47266782,220.
Show HN: Reformat Word document citations (APA/Vancouver) in <1 second,https://github.com/brodie-neuro/ScholarRef,221.
Z80 Sans – a disassembler in a font (2024),https://github.com/nevesnunes/z80-sans,222.
How Iran is using cheap drones to cause chaos across the Middle East,https://www.bbc.co.uk/news/resources/idt-b3a272f0-3e10-4f95-9cd1-b34ab8ad033c,223.
Claude is an Electron App because we've lost native,https://tonsky.me/blog/fall-of-native/,224.
